,date,title,article,url,thumbnail
31,"February 16, 2022",Salesforce Establishes Sustainability as a Core Company Value; Launches Net Zero Cloud 2.0 Globally,"

Salesforce further operationalizes sustainability throughout company; every employee and department now accountable to sustainability as a value 
In the new era of climate accountability, companies will need trusted emissions data to accelerate their journeys to net zero emissions
Net Zero Cloud 2.0 now available globally to help organizations like Mastercard, Deloitte Germany, Uhuru, and MillerKnoll reach their climate goals
Our planet needs everyone – governments, scientists, investors, businesses, and ecopreneurs – to take bold climate action today. 
Today, Salesforce officially announced sustainability as a core company value, joining its values of trust, customer success, innovation, and equality. And, to help organizations accelerate their own journeys to net zero emissions, Salesforce is also making Net Zero Cloud 2.0 — a solution that tracks greenhouse gas emissions — available globally.
“I’m extremely proud that we will now officially count sustainability as a core value, making it part of everyone’s job at Salesforce,” said Suzanne DiBianca, Chief Impact Officer & EVP of Corporate Relations, Salesforce. “When we add a value we operationalize it in every area of the business. In this climate emergency, we need every organization to get to net zero as fast as possible. Now that Salesforce has reached net zero emissions, we want to use our technology and best practices to help organizations reach their climate goals, too.”
I’m extremely proud that we will now officially count sustainability as a core value, making it part of everyone’s job at Salesforce. When we add a value we operationalize it in every area of the business.Suzanne DiBianca, Chief Impact Officer & EVP, Corporate Relations, Salesforce

Open Image Modal
Image Modal


Salesforce further integrates sustainability throughout company 
At Salesforce, values drive the company’s decision-making. Every employee and team knows Salesforce’s values and strives to live by them every day. 
With sustainability as a core value, Salesforce is leveraging its full power to drive climate action and further operationalize sustainability across its entire business. This means every internal organization incorporating sustainability into its V2MOM  — a Salesforce alignment process that drives the company’s success.
Salesforce today has net zero emissions and has been voluntarily reporting on its greenhouse gas emissions since fiscal year 2012. Since that time, the company has continued to increase the scope of its climate action strategy by actively engaging policymakers, peers, partners, suppliers, and customers to accelerate towards a collective net zero goal. And just last week, Salesforce announced that it is tying executive pay to environmental, social, and governance (ESG) performance, including two sustainability metrics. 
Mandatory climate reporting is coming
Regulatory change may soon require organizations to report on ESG matters, and many countries are already disclosing their climate-related financial risks and opportunities.
Legislatures and regulatory agencies in the United States are also considering disclosure rules. A bill that would require companies to disclose all greenhouse gas emissions is moving through the California legislature; and the U.S. SEC has solicited public input on voluntary climate change disclosures.
The next generation of Net Zero Cloud
In this new era of climate accountability, organizations’ carbon data will need to be as trusted as their financial data. Organizations will also need to know how to reduce emissions in a credible and meaningful way.


Net Zero Cloud 2.0 enables organizations to get sustainability insights with Tableau CRM dashboards
Net Zero Cloud 2.0 has been completely rebuilt to offer trusted reporting, deeper insights, and supplier management so that organizations can go net zero now. With Net Zero Cloud 2.0, organizations can get sustainability insights with powerful Tableau CRM dashboards to achieve their climate goals and take action with:
Carbon Footprint Forecast: Organizations can find the fastest path to net zero with ‘what-if’ analysis to visualize progress and alignment to their climate action commitments.Science-Based Targets: Setting goals in line with science-based targets and measuring progress. Supplier Management: Track scope 3 emissions across the entire value chain and help suppliers and distributors reduce emissions.Waste Data Management: Organizations can upload and track hazardous and non-hazardous waste management data and treatment methods like landfilled, composted, or combusted — all in one place.

Open Image ModalDashboard shows all Scope 3 emissions generated by suppliers in the procurement value chain.
Image Modal
Dashboard shows all Scope 3 emissions generated by suppliers in the procurement value chain.

Customers and partners are implementing Net Zero Cloud
Global companies across industries are already using Net Zero Cloud to reach their climate goals:
Mastercard (Global): Mastercard, a global technology company in the payments industry, is using Net Zero Cloud, with support from Accenture, to gain comprehensive insights around the emissions of its suppliers, enabling it to work more effectively with its partner network to take climate action.ISDI (France): ISDI, the world’s first digital business school, is using Net Zero Cloud to calculate the carbon footprint of each visitor to its Paris center based on the types of transportation used, length of hotel stay, and energy use onsite – made possible by strategic support from Accenture. Deloitte Germany (Germany): As one of the top companies for corporate travel, Deloitte Germany’s clients have been challenging them on the transparency of their carbon footprint and in some cases it is a deciding factor for winning business. With Net Zero Cloud, Deloitte Germany can track its carbon emissions on a project by project basis allowing clients and employees to have insight into the carbon cost of business.Uhuru (Japan): As a top digital transformation consulting services company, Uhuru is using Net Zero Cloud to track scope 1, 2, and 3 emissions to educate its employees about decarbonization and eventually enable them to use this knowledge to help clients with their sustainability mission. MillerKnoll (USA): MillerKnoll, a global leader in designs and furnishings, is using Net Zero Cloud with support from Salesforce consulting partner Orion Global Solutions to see its supplier environmental impact in one singular view. Its annual emissions report used to take hundreds of hours across 20 spreadsheets. Now, MillerKnoll knows where they stand relative to their goal at any time.
Salesforce’s consulting partners including Accenture, KPMG, Orion Global Solutions, PwC, Slalom, and Traction on Demand are actively implementing Net Zero Cloud for customers across industries. In addition, these partners provide advisory services to drive the digital transformation required for customers to accelerate their journeys to becoming net zero companies.
More information:
Visit Salesforce Sustainability to learn more.Listen to Clif Bar & Company Blazing Trails podcast.Salesforce #TeamEarth campaign.Learn how Salesforce is implementing its Climate Action Plan:Decarbonizing a Work from Anywhere World.Reducing Value Chain Emissions by Enabling Supplier Action.Business Travel in a Net Zero World.Decarbonizing IT Infrastructure.Advocating for Climate Action.Learn more about Salesforce partners here.Learn about Accenture and Salesforce’s sustainability partnership here.


Share


Share on Email





Share on Twitter





Share on Facebook





Share on LinkedIn





Tags

				Business as a Platform for Change			

				Company Culture			

				News Announcements: Corporate			

				Sustainability			

",https://www.salesforce.com/news/stories/salesforce-and-aws-deliver-offering-that-helps-content-distributors/,https://www.salesforce.com/news/wp-content/uploads/sites/3/2022/02/newsroom_SafetyCloud-1200x675-2.png?w=1024
32,"February 10, 2022",Introducing Trailblazer Ranch: Igniting the Next Chapter of Salesforce’s Culture,"

The past two years have challenged us to reimagine not only how we work, but also how we connect — and what it means to build a culture in an all-digital, work-from-anywhere world.
Having flexibility in where, when and how we work has made many of us simultaneously more productive and balanced. It has allowed parents to see more of their kids, recent graduates to live in affordable cities, and individuals to make more time for wellbeing. What started as a public health necessity has become an opportunity for employers and employees.
We know that flexible is the way forward. But we also know we need to align our company to our culture and safely get together, in person. Since the pandemic began, we’ve onboarded tens of thousands of employees remotely. Those employees have never met their manager or their teams in person. And many of our existing employees haven’t seen their colleagues face-to-face in two years. Finding ways to connect is the number one thing Salesforce employees asked for in our last employee survey. We need to bring back the spontaneity and joy that comes from being together in person, now.
Enter Trailblazer Ranch.



Trailblazer Ranch — igniting our culture for our next chapter
Culture is our greatest competitive advantage — it engages our people, drives the creation of our innovative products, and ultimately, helps our customers succeed.
With Trailblazer Ranch, we’re igniting our culture for our next chapter. We’re reimagining how and where we connect for the new world we’re in. Our physical spaces serve a different purpose today than they did two years ago. An essential part of our Success From Anywhere strategy is finding ways to empower our teams to come together and connect safely — and creating spaces that cultivate a sense of connection, collaboration, and joy.
Trailblazer Ranch is an exciting new gathering place where employees can forge trusted relationships with their colleagues, learn from one another, get inspired, grow in their career, get trained on the company, and give back to the community in a fun and safe environment. It is a place where we can share and strengthen the Salesforce culture, which is built around our values.
While we solidify our long-term Trailblazer Ranch site, our interim Trailblazer Ranch is a partnership with 1440 Multiversity, located in 75 acres in the beautiful Redwoods of Scotts Valley, California. We’ll collaborate with 1440 Multiversity to develop employee engagement programs, applying our joint research and learnings to future programs. Starting in March, we will host onboarding, trainings, skills building and talent development, bringing our employees together to connect in person.
This partnership will allow us to bring a Ranch-like experience to many of our employees now. At the same time, it’s important for all of our employees to experience the connection that will come from Trailblazer Ranch. So we’re exploring different ways to bring the Ranch to our Trailblazers around the world.
Trailblazer Ranch is an educational partnership with 1440 Multiversity, located on 75 acres in the beautiful redwoods of Scotts Valley, California. Photo credit 1440 Multiversity.The Redwood Amphitheater is one of nearly 20 outdoor gathering spaces for visitors at Trailblazer Ranch. Photo credit 1440 Multiversity. At Trailblazer Ranch, guests will be surrounded by nature with wellbeing, learning, giving back and fun at the center of the experience. Photo credit 1440 Multiversity.Guests dine in community with one another at 1440 Kitchen Table, enjoying delicious, sustainable meals that feature locally sourced ingredients. Photo credit 1440 Multiversity.
Disconnecting from technology and connecting with each other
After years of being on Zoom calls and staring at computer screens, we’re encouraging our employees to step away from their screens. According to a recent Deloitte study, employees are working three more hours a day compared to before the pandemic, and 80% of respondents ranked wellbeing as important or very important to their organization’s success. Trailblazer Ranch is an opportunity to disconnect from technology and connect with each other.
From the moment guests step foot on the Ranch, they’ll become immersed in Salesforce’s culture. They’ll have the opportunity to participate in tactile experiences like guided nature walks, restorative yoga, garden tours, group cooking classes, art journaling, and meditation. Learning, planning and team-building are important to the Trailblazer Ranch experience, but we can accomplish this in a whole new way — surrounded by nature, with wellbeing, giving back and fun at the center.
It’s not enough to create better experiences for employees — we want to extend the space to the community. As we’ve done with our ‘Ohana Floors in our Salesforce Towers around the world, we will open Trailblazer Ranch to local nonprofits and the community.
This is just the first phase of our Trailblazer Ranch journey. We look forward to creating meaningful connections and experiences with our Trailblazers around the world.
Read how Salesforce approaches Success from Anywhere here.

Share


Share on Email





Share on Twitter





Share on Facebook





Share on LinkedIn





Tags

				Company Culture			

				Future of Work			

				News Announcements: Corporate			

				Real Estate			

",https://www.salesforce.com/news/linked-content/tableau-powers-smarter-experiences-and-deeper-insights/,https://www.salesforce.com/news/wp-content/uploads/sites/3/2022/01/Digital-Skills-Tile-2.jpg?w=1024
