,date,title,article,url,thumbnail
0,"April 20, 2022",Salesforce Invites Future Tech Leaders to San Francisco for New Computer Science Pre-Internship,"

At Salesforce, we love our Futureforce interns. Every summer, they share their energy, passion and innovation with us — questioning the old way of doing things, taking on projects that have a real impact on the business, and making our employees, company, and communities better for having worked with them.
Our Futureforce program has helped us attract, retain, and cultivate the next generation of leaders at Salesforce, some of the most diverse and global employees at the company. We continue to invest in our interns and each year we convert up to 80% of our eligible interns to full-time employees.
Today, we’re proud to expand the program with Futureforce Tech Launchpad, a new pre-internship program, powered by CodePath, that will provide underrepresented students in computer science access to hands-on technical training, capstone projects, and mentorship earlier in their career journeys.
Developing the next generation of tech leaders
Starting in June 2022, we’ll invite 25 rising college juniors to our headquarters at Salesforce Tower in San Francisco for a 10-week, in-person experience with technical curriculum and one-on-one mentorship with Salesforce employees.
Students will be introduced to full-stack web development, and gain an understanding of database, back-end code, front-end code, testing, design and deployment, culminating in a capstone project of their choosing that will be presented to Salesforce employees and peers. In addition to technical skills, students will develop soft skills, such as networking, collaboration, communication, and presentation.
All of our pre-interns will receive compensation, benefits, and a relocation stipend to help maximize the experience and be immersed in the Salesforce culture. They will have opportunities to connect and collaborate with our Futureforce interns, so they can hopefully return as interns and, ultimately, as employees after graduation. And just like all of our Futureforce interns, Launchpad participants will receive paid Volunteer Time Off (VTO) to devote to causes they believe in.
To bring this program to life, Salesforce is partnering with CodePath, a nonprofit committed to increasing diversity in tech by transforming college computer science education for underrepresented minorities and underserved populations. CodePath will work in partnership with more than 70 universities, including HBCUs and HSIs, as well as its community of over 10,000 students to help identify computer science and engineering students to participate in the Futureforce Tech Launchpad. CodePath will also provide the curriculum and instructors for the program.
“Underrepresented minority and low-income students in computer science (CS) are more likely to drop out or switch majors before their junior year, and as a result, miss out on the work experience needed to launch successful tech careers,” said Michael Ellison, CEO at CodePath. “Salesforce’s decision to launch the Futureforce Tech Launchpad demonstrates inspiring corporate leadership and represents a bold commitment to eliminate systemic inequities in both computer science education and technical recruiting for communities of color.”
We look forward to welcoming, and learning from, the next generation of tech leaders this summer. We are committed to building a diverse pipeline of engineers and technical talent, and making meaningful careers in software engineering accessible to all.
Learn more about Futureforce Tech Launchpad and apply to be part of the program here.Read more about Salesforce’s commitment to equality here.

Share


Share on Email





Share on Twitter





Share on Facebook





Share on LinkedIn





Tags

				Equality			

				Future of Work			

				News Announcements: Corporate			

",https://www.salesforce.com/news/stories/salesforce-invites-future-tech-leaders-to-san-francisco/,https://www.salesforce.com/news/wp-content/uploads/sites/3/2022/04/FutureForce-1.jpg?w=1024
1,"April 20, 2022",Salesforce Announces New Customer 360 for Education Capabilities to Power the Future of Learning,"

According to the Salesforce Connected Student Report, 58% of higher education staff say their institutions are increasing investment in supporting learners from anywhere with more flexible, personalized experiences. The report also notes that while many students and a high percentage of staff prefer a high level of face-to face engagement, one in four students said that having more flexible courses and part-time offerings would help them succeed.With Customer 360 for Education, institutions can create their Student 360 to drive digital transformation across recruitment, admissions, the student experience, alumni relations, and marketing to deliver connected experiences from anywhere.

At the 10th annual Education Summit, Salesforce announced expanded offerings to help higher education institutions provide digital-first, flexible learning options; real-time and asynchronous collaboration; and personalized experiences for students, faculty, and staff. Customers such as Arizona State University (ASU) and INSEAD are already tapping into these new capabilities to meet growing student needs.  
“Institutions recognize the importance of having a strong digital foundation to support the experiences that today’s students and alumni demand,” said Susan Morrow, GM for Education Cloud at Salesforce. “Customer 360 for Education enables colleges and universities of all sizes to build their Student 360 and rapidly build new programs, such as executive education and flexible learning programs.”
Every Institution Can Create Their Student 360 with New Customer 360 for Education Capabilities
Enable digital-first, flexible experiences for the next generation of students 
As reported by Salesforce’s Digital Skills Index, 76% of the workforce feels unprepared for the future of work. Additionally, according to Salesforce’s Connected Student Report, 45% of higher education staff say their institutions are implementing new business models, such as credentialing or executive education courses, to provide flexible learning options and drive new revenue streams as undergraduate enrollment rates decrease. With Lifelong Learning, institutions can implement next-generation, digital-first experiences that make it easy for students to find tailored programs and courses. These “storefront”-style digital experiences surface programs such as elective and non-credit courses or certificates relevant to students’ interests and career growth, similar to how they experience an ecommerce site. Using Lifelong Learning, students can also access a self-service center that helps them easily add relevant courses to their purchase carts, complete registration, and manage payment all in one place. 


 Lifelong Learning powers executive, continuing, and online education programs to help institutions accelerate growth with streamlined student journeys.
72% of higher education staff globally said adjusting to virtual work has been a top challenge. With Digital Campus, institutions can become more connected to students, staff, and faculty with communication, collaboration, and insights tools in a single, easy-to-use, customized workspace whether they are on campus, in their living room, or traveling. With a student-centric One Stop as part of the Digital Campus, students, staff, and faculty can access on-demand support and services with easy-to-use search functions, chatbots, and live agent support. 


Support, engage, and retain your constituents from anywhere with the Digital Campus solution built for hybrid institutions of all sizes.
With Admissions Connect, institutions can streamline the admissions experience for both applicants and staff. With the Application Form Builder, admissions teams can now easily build customized, branded applications with clicks, not code. Because the forms are built using the power of the Salesforce platform, institutions can automate importing existing applicant data, such as education history, directly into the application.   
Real-time and asynchronous collaboration to support students from anywhere  Institutions around the globe are already using Slack to improve engagement and collaboration in real time or asynchronously. Now, with Student Success Alerts powered by Slack, faculty and staff can more efficiently support students and streamline communication between faculty and student-support staff in today’s education-from-anywhere world. For example, faculty can quickly raise alerts about at-risk students from an easy-to-use Slack app that feeds directly into Student Success Hub, streamlining communication between frontline faculty and instructors.

Open Image ModalWith Student Success Alerts, faculty and staff can use Slack to deliver student support fast with an app that feeds directly into Student Success Hub.
Image Modal
With Student Success Alerts, faculty and staff can use Slack to deliver student support fast with an app that feeds directly into Student Success Hub.

Personalize student and alumni relationships
Digital Marketing and Engagement helps institutions deliver personalized content, such as targeted onboarding journeys for new students, that foster a greater feeling of belonging in an online environment. For example, institutions can create tailored messaging and reminders — such as tips for moving into a specific dorm or ways to connect with students in the same major, virtually — as part of onboarding journeys.Relationship-Driven Fundraising makes it easy for institutions to identify alumni for targeted fundraising campaigns and create more personalized and engaging online giving experiences.
Customers like ASU and INSEAD are innovating for the future 
With Customer 360 for Education, ASU is creating lifelong student relationships from prospective students to engaged alumni. The university is putting their customers at the center of the ASU experience with flexible learning options across campus, online, or via a hybrid approach. “A big part of what makes ASU innovative is its commitment to, and energy for, scale and growth. Among a suite of tools, a platform like Salesforce supports that ambition,” said Lev Gonick, Chief Information Officer at ASU. “We contextualize innovation and apply it to purpose — a lot of the work we’ve done with Salesforce is informed by joining technology, innovation and student success.” 
Recognizing that many prospective students are balancing careers in addition to returning to school, INSEAD needed to deliver a hyper-personalized recruitment experience for its more than 20,000 executives globally. INSEAD also uses Customer 360 for Education to manage its entire recruitment experience from one unified platform.“As hybrid learning becomes the norm, personal connections are as crucial in executive education as they are in the workplace,” said Séverine Guilloux, Executive Director of Open Programmes and Online Learning Innovation at INSEAD. “With Customer 360 for Education, we can deliver connected learning journeys with a personal touch and create long-lasting relationships with our participants and community of students.”
More information 
Explore the Future Ready Playbook to learn how institutions can evolve with new business models and student experiences. Find out more about Digital Campus and Lifelong Learning. Watch a demo featuring our Student Success product innovations.Read the Second Edition Connected Student Report to uncover the latest insights and global higher education trends from over 2,000 students and staff.


Share


Share on Email





Share on Twitter





Share on Facebook





Share on LinkedIn





Tags

				Digital Transformation			

				Industry Solutions			

				News Announcements: Product			

",https://www.salesforce.com/news/stories/salesforce-announces-new-customer-360-for-education-capabilities/,https://www.salesforce.com/news/wp-content/uploads/sites/3/2022/04/EducationSummit.jpg?w=1024
2,"April 19, 2022",Salesforce Hits Half a Billion Dollars in All-Time Giving,"

Salesforce has reached over half a billion dollars in all-time philanthropic giving — a total of $532 million in grants since its founding. Salesforce also surpassed $100 million in annual giving in the 2022 fiscal year — a first for the company. 
“This is an incredible milestone for our team, and a testament to how our 1-1-1 model has evolved and increased in impact as our company has grown,” said Rebecca Ferguson, SVP of Philanthropy, Salesforce. “As we look ahead, we will continue to iterate on how we give and work with our partners on the ground who are finding solutions to key issues in our communities.”

Open Image Modal
Image Modal


Salesforce’s growth helps drive giving efforts
By giving 1% of equity, product, and employee time back to its communities, Salesforce’s ability to give is directly tied to company growth. With overall revenue up 26% year-over-year, the ways in which Salesforce is able to give continues to expand. 
In addition to monetary giving, more than 54,000 nonprofits and education organizations have received free or discounted product from Salesforce.org, and Salesforce employees have given over 6.7 million volunteer hours to their communities.
Salesforce’s giving goes further as company acquisitions boost giving
As the company grows through acquisitions, philanthropic reach grows even wider:
Since its founding in 2014, Tableau Foundation has contributed nearly $100 million in software services and financial support to nearly 11,000 organizations working in more than 125 countries. In 2021, Slack donated $54 million to the Salesforce Foundation to support community investments. MuleSoft employees have donated $988,000 in all-time giving.
More information
Learn about Salesforce’s approach to philanthropy. Hear from Salesforce SVP of Philanthropy Naomi Morenzoni. Join Salesforce’s efforts by learning about Pledge 1%.Learn more about Salesforce volunteer and giving programs here.

Share


Share on Email





Share on Twitter





Share on Facebook





Share on LinkedIn





Tags

				Business as a Platform for Change			

				News Announcements: Corporate			

				Philanthropy			

",https://www.salesforce.com/news/stories/salesforce-hits-half-a-billion-dollars-in-all-time-giving/,https://www.salesforce.com/news/wp-content/uploads/sites/3/2022/04/Philanthropy.jpg?w=1024
3,"April 13, 2022",Salesforce Launches New Initiatives to Grow Sustainable Ocean-Based Carbon Markets,"

Salesforce and global environmental NGOs will co-lead effort to help define high-quality blue carbon projects and credits 
Salesforce joins ORRAA to help drive their commitment of $500 million to strengthen climate resilience of coastal communities
Salesforce hires UN leader Tim Christophersen as incoming Vice President of Climate Action
Today at the Our Ocean Conference convened in the Republic of Palau, Salesforce announced a global collaborative effort aimed at driving consistent standards around high-quality blue carbon projects and credits. 
Blue carbon is the carbon captured by ocean and coastal ecosystems, such as mangroves and seagrasses, that is increasingly used by companies to offset their carbon emissions on their paths to reach net zero by 2050.
As businesses, investors and governments look to scale the blue carbon market, it’s critical that investments are made in high quality projects while also yielding community leadership, transparency, and standardization.
“We want to leverage the power of nature to capture carbon and fight climate change. As investments in the blue carbon market grow, we must ensure that projects truly safeguard biodiversity, protect coastal and marine ecosystems, and ultimately improve the livelihoods of people in local communities,” said Whitney Johnston,  Ph.D., Director of Ocean Sustainability at Salesforce. 
The initiative will be co-led by Salesforce and leading environmental organizations, including the World Economic Forum’s Friends of Ocean Action, Ocean Risk and Resilience Action Alliance (ORRAA), Conservation International, and The Nature Conservancy, along with the Meridian Institute, to support the stakeholder engagement process. A draft set of principles and definitions will be circulated for public comment in June 2022 at the United Nations Ocean Conference in Lisbon. 
As Salesforce decarbonizes its business, we’re leveraging technology, philanthropy,  mobilization, policy, and investments in nature-based solutions to reach our climate goals”Dr Whitney Johnston, Director of ocean sustainability, salesforce
As part of its ongoing commitment to help develop the emerging blue carbon market, Salesforce set a goal to purchase 1 million tons of high-quality blue carbon credits, equivalent to more than $10 million USD, over the next four years.
“As Salesforce decarbonizes its business, we’re leveraging technology, philanthropy, mobilization, policy, and investments in nature-based solutions to reach our climate goals,” said Dr. Johnston.
Salesforce joins ORRAA to increase investment in ocean protection
Several factors — including pollution, over-extraction, habitat damage and climate change — have imperiled the ocean economy. By 2050, 800 million people globally will be vulnerable to coastal flooding and storm surges from rising sea levels. Coastal ecosystems, like reefs and mangroves, serve as powerful buffers against storms and flooding, and support livelihoods, food security, and culture. However, less than 1% of the total value of the ocean has been invested in sustainable projects through philanthropy and official development assistance. 
That’s why Salesforce is joining ORRAA, a multi-stakeholder collaboration with a goal to drive at least $500 million of investment into coastal projects by 2030. The United States also announced its support for ORRAA, including a $1 million contribution.
“At the moment, there are too few on-the-ground solutions which can be a source for high-quality, verifiable blue carbon credit products ready to go to market, and no clear benchmarks or definitions of what a high-quality blue carbon product is – or should be,” said Karen Sack, Executive Director, ORRAA. “It is also important to develop demand-side guardrails to ensure that blue carbon credits are additional – not an alternative – to efforts to reach net zero. We are delighted that Salesforce is joining ORRAA and to be working jointly with them and other partners on this effort.”
Since founding the Ocean Sustainability Program in 2021, Salesforce has given nearly $3 million through philanthropy to organizations working to conserve and restore coastal and marine ecosystems.
Salesforce hires former UN head of nature based solutions 
Salesforce has hired global sustainability leader Tim Christophersen as the incoming Vice President of Climate Action to drive Salesforce’s strategy around nature-based solutions to climate challenges, and accelerate the company’s international sustainability work. 

Open Image ModalTim Christophersen, Salesforce’s Vice-President of Climate Action
Image Modal
Tim Christophersen, Salesforce’s Vice-President of Climate Action

“Science tells us that it’s now or never to take climate action. We’re already experiencing the first effects of climate change, from extreme weather events and wildfires, to rapid loss of biodiversity, and growing global inequality,” said Christophersen. 
“Businesses can quickly and decisively scale up all the right solutions now for people, nature and climate laid out by the latest IPCC report. That’s why I’m proud to join Salesforce and leverage its full power on behalf of our planet.”
Before joining Salesforce, Christophersen served as the head of Nature for the Climate Branch, and Coordinator of the UN Decade on Ecosystem Restoration at the United Nations Environment Programme. He holds a degree in forestry from the Dresden University of Technology in Germany, and will be based in Denmark.

More information
Register here to follow and participate in the blue carbon market principles stakeholder engagement process. Join the #TeamEarth community and find opportunities to take action here.


Share


Share on Email





Share on Twitter





Share on Facebook





Share on LinkedIn





Tags

				Business as a Platform for Change			

				News Announcements: Corporate			

				Sustainability			

",https://www.salesforce.com/news/stories/salesforce-launches-new-initiatives-to-grow-sustainable-ocean-based-carbon-markets/,https://www.salesforce.com/news/wp-content/uploads/sites/3/2022/04/oceans-1.png?w=1024
4,"April 12, 2022",Eurotunnel and Salesforce Team up to Power Digital Transformation,"

Eurotunnel today announced a partnership with Salesforce to support its digital transformation and enhance engagement with its customers. 
By leveraging Salesforce Marketing Cloud, Eurotunnel, which manages the infrastructure of the Channel Tunnel and operates truck and passenger shuttle services (cars and coaches) between Folkestone (UK) and Calais (France), aims to further improve the services it offers to its customers and create outstanding travel experiences. 
Salesforce Marketing Cloud will also enable Eurotunnel’s Le Shuttle to engage with all its customer segments across multiple channels in a more personalized manner and in doing so, create meaningful interactions. 
“Eurotunnel is setting the standard for international travel and customer service,” said Michael Green, Senior Vice President Retail, Consumer Goods, Travel, Transport and Hospitality, Salesforce UKI. “Today every business needs to have a digital-first mindset, and is a great example of a brand reimagining themselves for the future in an all-digital world. We’re excited to partner with Eurotunnel Le Shuttle as they deliver personalized and memorable experiences for their customers.”
More information:
For more on the news, visit this page. Read the latest Marketing Cloud news here.

Share


Share on Email





Share on Twitter





Share on Facebook





Share on LinkedIn





Tags

				Digital Transformation			

				News Announcements: Customer			

",https://www.salesforce.com/news/stories/eurotunnel-and-salesforce-team-up-to-power-digital-transformation/,https://www.salesforce.com/news/wp-content/uploads/sites/3/2022/04/Eurotunnel.jpg?w=1024
