date,title,article,url,thumbnail,author
22 April 2022,Saab’s Results January-March 2022: A solid start to the year in a changing landscape,"Key highlights Q1 2022Order intake of SEK 8,115m (5,871), corresponding to a growth of 38%, with increases in most business areas driven by medium-sized orders. Sales amounted to SEK 9,218m (9,088), with a growth of 1.4%.EBITDA increased and amounted to SEK 1,148m (1,066), with a margin of 12.5% (11.7).Operating income improved 10% and amounted to SEK 654m (597). The margin was 7.1% (6.6), driven by improved project execution and a favourable product mix.Operational cash flow in the quarter was SEK -179m (-160).Sustainability efforts continued with submittal of proposed targets to the Science-Based Targets initiative.The AGM decided on a dividend of SEK 4.90 per share to the shareholders.Statement by the President and CEO Micael Johansson:A solid start to the year in a changing landscapeWe entered the year with hopes of a return to normal after the pandemic, but we are now witnessing a humanitarian tragedy as a result of the war in Ukraine. This reminds us once again of the importance of countries’ right to build their defences to protect their borders, citizens and societies. Our core belief is that peace, security and stability are fundamental for sustainability, human rights and freedom.Early implications of the crisis have changed the security landscape in Europe. This has led to a structural shift with several countries, including Sweden, Germany, UK and Finland, announcing higher defence budgets over the coming years. Saab is well positioned and ready to support customers’ growing needs. Given the long-term nature of the industry, however, the prospects for further growth in orders will take some time.Due to the pandemic, we have worked intensively over the past years to manage our supply chain. With the growing geopolitical instability in the world, we see further supply chain challenges in our industry, as in many other businesses. We are working closely with our suppliers to mitigate future effects on shortages and ensure delivery of components. To meet a further demand, we will also steadily increase capacity.In the first quarter of the year, we continued to see strong interest in Saab’s portfolio, particularly in Dynamics and Surveillance. Order intake increased by 38%, driven by medium-sized orders across most business areas. Order intake in our international markets increased by 78%. Dynamics received orders for training systems to the U.S. and Finland, and Surveillance received a contract for a civil security solution in Australia. At Kockums, a large contract from Sweden for the Mid-Life Upgrade of the third Gotland-class submarine was received.At the end of the quarter, the first two serially produced Gripen E fighters arrived in Brazil and their first flight in the country with Brazilian pilots has now been completed. This is an important achievement in the Gripen E programme where the two fighter jets are part of the 36 aircraft acquired by the Brazilian Air Force in 2014.Sales increased compared to the first quarter last year and amounted to SEK 9,218 million (9,088). Reported growth was 1.4%, reflecting the delivery pattern for the year that is stronger in the second half. Dynamics, Kockums and Combitech reported sales growth while sales in Aeronautics and Surveillance declined. We reiterate our sales growth outlook of around 5% for the full year.Operating income improved 10% and amounted to SEK 654m (597) in the quarter, corresponding to a margin of 7.1% (6.6). This was driven by higher gross margin as a result of improved project execution and a favourable product mix.Operational cash flow in the quarter was in line with our milestone payments plan and amounted to SEK -179 million (-160).During the quarter, we continued our extensive work on sustainability and strengthened our governance further. Consequently, we submitted proposed targets to the Science-Based Targets initiative connected to the Race to Zero commitment we announced last year.As we leave a solid first quarter behind us, we will continue our journey with a focus on sustainable growth, strengthened profitability and cash flow.Financial highlightsMSEK Jan-Mar 2022 Jan-Mar 2021  Change, % Full Year 2021 Order bookings 8,115 5,871 38 43,569Order backlog 104,537 97,211 8 105,177Sales 9,218 9,088 1 39,154Gross income 2,034 1,934 5 8,205Gross margin, % 22.1 21.3 21.0EBITDA 1,148 1,066 8 4,826EBITDA margin, % 12.5 11.7 12.3Operating income (EBIT) 654 597 10 2,888Operating margin, % 7.1 6.6 7.4Net income 372 396 -6 2,025of which Parent Company’s shareholders’ interest 354 392 -10 1,926Earnings per share after dilution, SEK 2.66 2.94 14.45Return on equity, % ¹⁾ 8.4 5.2 9.0Operational cash flow -179 -160 3,276Free cash flow -361 -265 2,737Free cash flow per share after dilution, SEK -2.71 -1.99 20.53Average number of shares after dilution 133,267,371 133,213,468 133,293,340¹⁾  Return on equity is measured over a rolling 12-month period.MSEKOrder bookingsOrder backlogSalesGross incomeGross margin, %EBITDAEBITDA margin, %Operating income (EBIT)Operating margin, %Net incomeof which Parent Company’s shareholders’ interestEarnings per share after dilution, SEKReturn on equity, % ¹⁾Operational cash flowFree cash flowFree cash flow per share after dilution, SEKAverage number of shares after dilution¹⁾  Return on equity is measured over a rolling 12-month period.For more information and explanations regarding the usage of these key ratios, please see http://saab.com/investors/financial-data/key-ratios/Saab’s Interim Report January-March 2022 PresentationSaab’s CEO and President Micael Johansson and CFO and deputy CEO Christian Luiga will present the Saab interim report for January-March 2022.Date:            Friday, 22 April at 10:00 (CET).The report is published at 07.30 a.m. (CET) the same day at http://www.saab.com. You are welcome to watch the live webcast or dial in to the conference call. It is possible to post questions over the conference call and the web. Live webcast: https://www.saab.com/investors/webcast/q1-2022Conference call:Please, dial in using one of the numbers below.Sweden:                           +46 8 5664 2706United Kingdom:              +44 333 300 9268 United States:                   +1 646 722 4903The interim report, the presentation material and the webcast will be available on http://www.saab.com/investors.For further information, please contact:Mattias Rådström, Press Officer+46 (0)734 180 018presscentre@saabgroup.comMerton Kaplan, Head of Investor Relations+46 (0)734 182 071merton.kaplan@saabgroup.comwww.saab.comFollow us on twitter: @saabSaab is a leading defence and security company with an enduring mission, to help nations keep their people and society safe. Empowered by its 18,000 talented people, Saab constantly pushes the boundaries of technology to create a safer, more sustainable and more equitable world. Saab designs, manufactures and maintains advanced systems in aeronautics, weapons, command and control, sensors and underwater systems. Saab is headquartered in Sweden. It has major operations all over the world and is part of the domestic defence capability of several nations.The information is such that Saab AB is obliged to make public pursuant to the EU Market Abuse Regulation. The information was submitted for publication, through the agency of the contact person set out above, on 22 April 2022 at 07.30 (CET).",https://www.saab.com/newsroom/press-releases/2022/saabs-results-january-march-2022-a-solid-start-to-the-year-in-a-changing-landscape,"https://res.cloudinary.com/dkkd45ayz/image/upload/f_auto,q_auto,dpr_auto/w_3360,h_1890,c_fill,g_auto/w_2048,h_1152,c_scale/episerver/649ff424-c54e-471a-b190-3970996de638/20220422-en-4243092-1.jpg",SAAB
11 April 2022,Saab Receives Order for Gripen C/D Upgrade,"Gripen C/D is the system that will be used for many years to come in Sweden and in other countries that have purchased Gripen. The development is also done to further ensure a cost-effective solution regarding construction, design and procurement.“Gripen C/D is the backbone of the Swedish Armed Forces today and will continue to be for many years to come, so this is an important order where we will ensure the continued operation and operational relevance of Gripen C/D,” says Jonas Hjelm, Head of Saab’s Aeronautics business area.The purpose of the order is to start implementation of the upgrade to fulfil the Swedish Armed Forces’ need to maintain the continued high capability and availability of Gripen C/D up to 2035.For further information, please contact:Saab's press centre+46 (0)734 180 018presscentre@saabgroup.comwww.saab.comTwitter: @SaabFacebook: @Saab LinkedIn: SaabInstagram: SaabSaab is a leading defence and security company with a mission to help nations protect their populations and to contribute to the safety of people and societies. With 18,000 talented employees, Saab develops technology and solutions for a safer, more sustainable, and more just world.  Saab develops, manufactures, and maintains sophisticated systems within aeronautics, weapons, and sensors, as well as management systems and underwater systems. Saab is headquartered in Sweden, but has global operations through which the company contributes to many nations’ defence capabilities.",https://www.saab.com/newsroom/press-releases/2022/saab-receives-order-for-gripen-cd-upgrade,"https://res.cloudinary.com/dkkd45ayz/image/upload/f_auto,q_auto,dpr_auto/w_4872,h_2741,c_fill,g_auto/w_2048,h_1152,c_scale/episerver/cd82209d-e487-47f4-9a80-c12ee4a0aa6b/20220411-en-4235264-1.jpg",SAAB
8 April 2022,Invitation to Saab’s Interim Report Q1 2022 Presentation,"Date:            Friday, 22 April at 10:00 (CET).The report is published at 07.30 a.m. (CET) the same day at http://www.saab.com. You are welcome to watch the live webcast or dial in to the conference call. It is possible to post questions over the conference call and the web. Live webcast: https://www.saab.com/investors/webcast/q1-2022Conference call:Please, dial in using one of the numbers below.Sweden:                            +46 8 5664 2706United Kingdom:              +44 333 300 9268 United States:                   +1 646 722 4903The interim report, the presentation material and the webcast will be available on http://www.saab.com/investors.For further information, please contact:Merton Kaplan, Head of Investor Relations+46 (0)734 182 071merton.kaplan@saabgroup.comSaab Press Centre,+46 (0)734 180 018presscentre@saabgroup.comwww.saab.comFollow us on twitter: @saabSaab is a leading defence and security company with an enduring mission, to help nations keep their people and society safe. Empowered by its 18,000 talented people, Saab constantly pushes the boundaries of technology to create a safer, more sustainable and more equitable world. Saab designs, manufactures and maintains advanced systems in aeronautics, weapons, command and control, sensors and underwater systems. Saab is headquartered in Sweden. It has major operations all over the world and is part of the domestic defence capability of several nations.",https://www.saab.com/newsroom/press-releases/2022/invitation-to-saabs-interim-report-q1-2022-presentation,"https://res.cloudinary.com/dkkd45ayz/image/upload/f_auto,q_auto,dpr_auto/w_8256,h_4644,c_fill,g_auto/w_2048,h_1152,c_scale/episerver/392ddd7a-c4d0-4434-b28e-046b5f5018ea/20220408-en-4233673-1.jpg",SAAB
7 April 2022,Saab’s Digital Tower Achieves Significant Approval from UK Military Regulator,"Saab has been successfully accredited under the Air Traffic Management (ATM) Equipment Approved Organisation Scheme (AAOS) by the UK Military Aviation Authority and is approved to develop, provide, install and maintain ATM equipment for customers in the UK Ministry of Defence under Regulatory Article 1027. (https://www.gov.uk/government/publications/list-of-maa-approved-organisations) This is an important step required to be able to deliver ATM equipment to the UK Armed Forces.The AAOS approval was achieved following a year-long effort of working alongside the UK’s Military Aviation Authority (MAA). It is noteworthy as being the first AAOS ever issued for a delivery organisation for military Digital Tower ATM equipment, a unique achievement for Saab.“This is an important step for us to support the UK MOD with the expansion of digital towers and we are proud to have the only accredited solution that complies with their regulations,” says Per Ahl, CEO of Saab Digital Air Traffic Solutions.The MAA, established in April 2010, is one of the world’s premier defence aviation safety bodies, recognised globally for its high standards and risk-based safety focus. This approval further strengthens Saab’s UK credentials, building on the Civil Aviation Authority’s approval gained in 2018.Other Saab Digital Air Traffic Solution approvals include certification to provide Air Traffic Services and MET-observation services according to EU-regulation (EU) 2017/373, providing digital ATC as a service at four Swedish airports. Saab Digital Air Traffic Solutions also holds ISO certification 9001, 14001 and 27001.For further information, please contact:Saab Press Centre,+46 (0)734 180 018presscentre@saabgroup.comNicolas Clark, Head of Saab UK Corporate AffairsMobile: +44 (0)7856 001 858nicolas.clark@saabgroup.comwww.saab.comTwitter: @SaabFacebook: @saab LinkedIn: SaabInstagram: SaabSaab is a leading defence and security company with an enduring mission, to help nations keep their people and society safe. Empowered by its 18,000 talented people, Saab constantly pushes the boundaries of technology to create a safer, more sustainable and more equitable world. Saab designs, manufactures and maintains advanced systems in aeronautics, weapons, command and control, sensors and underwater systems. Saab is headquartered in Sweden. It has major operations all over the world and is part of the domestic defence capability of several nations.Saab Digital Air Traffic Solutions (SDATS) is a subsidiary within Saab. By combining operational experience and world-class technical solutions, Saab Digital Air Traffic Solutions can manage the entire process from planning and implementation to the administration of air traffic control services.",https://www.saab.com/newsroom/press-releases/2022/saabs-digital-tower-achieves-significant-approval-from-uk-military-regulator,"https://res.cloudinary.com/dkkd45ayz/image/upload/f_auto,q_auto,dpr_auto/w_4859,h_2733,c_fill,g_auto/w_2048,h_1152,c_scale/episerver/95dd25fe-c075-4fb8-9129-f95ad2a3aace/20220407-en-4232749-1.jpg",SAAB
6 April 2022,The First Serial Production Gripen E Fighters are in Brazil,"The flights were conducted by two Brazilian Air Force pilots, who participated in training in Sweden. The flight to Gavião Peixoto lasted approximately 50 minutes and took place as planned.For the Commander of the Brazilian Air Force, General Carlos de Almeida Baptista Junior, the arrival of the first two operational aircraft represents a milestone for the defense of Brazil’s national airspace.""The arrival of the aircraft is the result of a project that sought from the beginning to increase our deterrent capabilities, as well as having the objective to foster research and industrial development in Brazil. We now have a state-of-the-art multi-mission aircraft that will be the main asset for guaranteeing the sovereignty of Brazilian airspace,” highlighted the Commander.The new fighters will remain at the Gripen Flight Test Center until the aircraft obtain the Military Type Certificate, thereafter they will be transferred to Anápolis for the final stages of the delivery phase.“Brazil actively participates in the development, flight test campaign and production of fighter jets, as part of the broad technology transfer package to the Brazilian defence industry. The arrival of the two serial production aircraft is a result of this great collaboration,” highlighted Jonas Hjelm, Senior Vice President and Head of Business Unit Aeronautics at Saab.The two fighter jets are part of the 36 Gripen aircraft acquired by the Brazilian Air Force in 2014.For further information, please contact:Saab Press Centre,+46 (0)734 180 018,presscentre@saabgroup.comwww.saab.comTwitter: @SaabFacebook: @SaabLinkedIn: SaabInstagram: SaabSaab is a leading defence and security company with an enduring mission, to help nations keep their people and society safe. Empowered by its 18,000 talented people, Saab constantly pushes the boundaries of technology to create a safer, more sustainable and more equitable world. Saab designs, manufactures and maintains advanced systems in aeronautics, weapons, command and control, sensors and underwater systems. Saab is headquartered in Sweden. It has major operations all over the world and is part of the domestic defence capability of several nations.",https://www.saab.com/newsroom/press-releases/2022/the-first-serial-production-gripen-e-fighters-are-in-brazil,"https://res.cloudinary.com/dkkd45ayz/image/upload/f_auto,q_auto,dpr_auto/w_5969,h_3358,c_fill,g_auto/w_2048,h_1152,c_scale/episerver/08589ec0-48da-4dc6-86d9-18ff37ebfcbd/20220406-en-4231981-1.jpg",SAAB
