Project Name,Procuring Entity,OCID,Project Cost,Contractor,Class,Asset Range,No of Employee,Year,Status,Remark,Award Date,Publication Date,Project Location
Procurement on the Maintenance of Alausa Sewer Network at the Secretariat Alausa Ikeja.,LAGOS STATE WASTE WATER MANAGEMENT OFFICE,ocds-5q8fsw-6202258785238,"₦23,814,176.46",SLITHERS NIGERIA LIMITED,Private Organization,,0,2021,COMPLETED,,"Sunday, June 6, 2021",2022-06-09,Unspecified
Event Planning of world Environment Day,OFFICE OF ENVIRONMENTAL SERVICES,ocds-5q8fsw-6202272164146,"₦13,049,000.00",STEZE GLOBAL RESOURCES LTD,Private Organization,,0,2021,COMPLETED,,"Thursday, July 29, 2021",2022-06-09,LAGOS
Procurement of four (4) Nos of fairly used suzuki Mini Buses- 2 WD Manual Transmission and other consolation Prizes for Sanitation Competition amongs LGs and LCDAs,OFFICE OF ENVIRONMENTAL SERVICES,ocds-5q8fsw-6202247265387,"₦19,916,000.00",CIVIL HYDRO RELIANCE LIMITED,Private Organization,,0,2021,COMPLETED,,"Thursday, July 22, 2021",2022-06-09,LAGOS
Renovation of storage Facility Ministry of the Environment and Water Resources,OFFICE OF ENVIRONMENTAL SERVICES,ocds-5q8fsw-6202252213166,"₦8,625,013.72",STONEWORKS LIMITED,Private Organization,,0,2021,COMPLETED,,"Wednesday, April 7, 2021",2022-06-09,IKEJA
Procurement of Stationery and other consumables for Planning Unit,OFFICE OF ENVIRONMENTAL SERVICES,ocds-5q8fsw-6202251221885,"₦1,446,850.00",BASOG EQUIPMENT NIGERIA LIMITED,Private Organization,,0,2021,COMPLETED,,"Tuesday, June 29, 2021",2022-06-09,ALAUSA
PROCUREMENT ON THE RELIEF WORK ON SITED SEWER NETWORKS AND PROVISION OF MAINTENANCE TOOLS AT IPONRI WASTEWATER TREATMENT PLANT(WWPT)SURULERE,LAGOS STATE WASTE WATER MANAGEMENT OFFICE,ocds-5q8fsw-6202272082308,"₦7,560,911.56",STONEWORKS LIMITED,Private Organization,,0,2021,COMPLETED,,"Wednesday, March 31, 2021",2022-06-09,"SURULERE, LAGOS"
PROCUREMENT ON THE RELIEF WORK ON SITED SEWER NETWORKS AND PROVISION OF MAINTENANCE TOOLS AT IPONRI WASTEWATER TREAT+B5MENT PLANT(WWPT)SURULERE,LAGOS STATE WASTE WATER MANAGEMENT OFFICE,ocds-5q8fsw-6202255146388,"₦4,994,380.13",CIVIL HYDRO RELIANCE LIMITED,Private Organization,,0,2021,COMPLETED,,"Wednesday, March 31, 2021",2022-06-09,"SURULERE, LAGOS"
"Annual Payment to LASG for the Lease and Redevelopment Plan of Government Staff Quarters Situated at 16, Sanni Adewale Str. Lagos Island Lagos into a Modern Shopping Plaza by CorporateBuildings Ltd & Messrs  Amkab Property Ventures Jointly Executed on a Build, Operate and Transfer (B.O.T) Agreement",PUBLIC SERVICE OFFICE,ocds-5q8fsw-6202211325256,"₦6,000,000.00",CORPORATE BUILDINGS LIMITED,Private Organization,"₦25,000,001 to ₦50,000,000",32,2021,COMPLETED,,"Monday, December 20, 2021",2022-06-09,LAGOS ISLAND
"Renovation of the Lagos State Public Service Club Premises at Ikeja, Ikorodu and Badagry",PUBLIC SERVICE OFFICE,ocds-5q8fsw-6202284886028,"₦77,542,988.80",MESSRS METROL FITTINGS AND ACESSORIES NIGERIA LIMITED,Private Organization,,0,2021,COMPLETED,,"Tuesday, May 4, 2021",2022-06-09,Unspecified
"Completion of Construction of LMDGP Building at Community Secondary School, Itire",MINISTRY OF EDUCATION,ocds-5q8fsw-6202268436352,"₦360,939,446.31",MDD PROJECTS LIMITED,Private Organization,,0,2022,NEW,,"Friday, May 20, 2022",2022-06-09,"ITIRE, LAGOS"
Procurement of Science Materials for State Senior Secondary Schools for Year 2022 West African Secondary School Certificate (WASSC) for School Candidates Practical Examinations,MINISTRY OF EDUCATION,ocds-5q8fsw-6202230458057,"₦75,485,100.00",MCDONALD SCIENTIFIC EMPORIUM,Private Organization,,0,2022,NEW,,"Monday, April 25, 2022",2022-06-09,LAGOS STATE
CONSTRUCTION OF 11 FLOOR LUXURY APARTMENTS AT ISALE-IGANGAN,LAGOS STATE URBAN RENEWAL AUTHORITY (LASURA),ocds-5q8fsw-6202220120676,"₦171,960,729.43",ANATOLIA INTERNATIONAL LIMITED,Private Organization,,0,2022,ON-GOING,ONGOING,"Monday, April 11, 2022",2022-06-09,LAGOS
"UPGRADING OF  THE NEWLY ACQUIRED LASURA PROPERTY AT 168/170 OBA AWOLOWO WAY,LAGOS",LAGOS STATE URBAN RENEWAL AUTHORITY (LASURA),ocds-5q8fsw-6202218601713,"₦38,454,807.20",JIRE'S PROPERTY COMPANY,Private Organization,"₦50,000,001 to ₦100,000,000",32,2021,ON-GOING,ONGOING,"Monday, December 20, 2021",2022-06-09,"AWOLOWO WAY, LAGOS"
"Procurement of Computer accessories, consumables and tools Equipment for ICT",OFFICE OF ENVIRONMENTAL SERVICES,ocds-5q8fsw-6202286377442,"₦5,399,600.00",RUSHIESMART NIGERIA ENTERPRISES,Private Organization,,0,2021,COMPLETED,,"Thursday, May 20, 2021",2022-06-09,LAGOS STATE
PREPARATION OF OBALENDE REDEVELOPMENT PLAN,LAGOS STATE URBAN RENEWAL AUTHORITY (LASURA),ocds-5q8fsw-6202248716206,"₦95,733,889.00",BELTON CONCEPTS LIMITED,Private Organization,,0,2021,COMPLETED,COMPLETED,"Tuesday, September 28, 2021",2022-06-09,"OBALENDE, LAGOS"
PROCUREMENT /OF OFFICE EQUIPMMENT/FURNITURE,LAGOS STATE URBAN RENEWAL AUTHORITY (LASURA),ocds-5q8fsw-6202278325768,"₦23,096,912.50",ORIGIN FURNITURE WAREHOUSE LIMITED,Private Organization,,0,2021,COMPLETED,COMPLETED,"Tuesday, September 7, 2021",2022-06-09,IKEJA LAGOS
Hiring of Heavy duty Equipment for enforcement activities for Year 2021,OFFICE OF ENVIRONMENTAL SERVICES,ocds-5q8fsw-6202216287556,"₦9,582,000.00",STONEWORKS LIMITED,Private Organization,,0,2021,COMPLETED,,"Sunday, April 18, 2021",2022-06-09,LAGOS STATE
UPGRADING OF 2 ROADS IN SURULERE LOCAL GOVERNMENT AREA,LAGOS STATE URBAN RENEWAL AUTHORITY (LASURA),ocds-5q8fsw-6202257008161,"₦1,094,917,342.54",BASNAZ CONSTRUCTION LIMITED,Private Organization,,0,2021,ON-GOING,ONGOING,"Monday, July 26, 2021",2022-06-09,"SURULERE, LAGOS"
UPGRADING OF 13 NO. ROADS IN SHOMOLU LOCAL GOVERNMENT AREA,LAGOS STATE URBAN RENEWAL AUTHORITY (LASURA),ocds-5q8fsw-6202275764705,"₦4,125,705,970.16",SAIL THROUGH CONSTRUCTION LIMITED,Private Organization,,0,2021,ON-GOING,,"Monday, July 26, 2021",2022-06-09,Unspecified
Procurement of Office Furniture for the Ministry,OFFICE OF ENVIRONMENTAL SERVICES,ocds-5q8fsw-6202216655413,"₦9,341,400.00",HORTON TIMS VENTURES,Private Organization,,0,2021,COMPLETED,,"Monday, May 10, 2021",2022-06-09,LAGOS STATE
Enhancement and Distribution of Covid-19 Preventive Items for PWDs.,OFFICE OF DISABILITY AFFAIRS,ocds-5q8fsw-6202223155438,"₦3,660,000.00",G.O. DYNASTY,Private Organization,,0,2021,COMPLETED,,"Tuesday, December 21, 2021",2022-06-09,"ALAUSA, IKEJA"
UPGRADING OF 2 ROADS IN SURULERE LOCAL GOVERNMENT AREA,LAGOS STATE URBAN RENEWAL AUTHORITY (LASURA),ocds-5q8fsw-6202220160400,"₦939,974,369.46",CONSTENG LIMITED,Private Organization,,0,2021,ON-GOING,ONGOING,"Monday, July 26, 2021",2022-06-09,"SURULERE, LAGOS"
Year 2021 Celebration of International Children’s Day Celebrating Children Living with Disabilities,OFFICE OF DISABILITY AFFAIRS,ocds-5q8fsw-6202258337082,"₦5,350,000.00",NEOTS LIMITED,Private Organization,,0,2021,COMPLETED,,"Wednesday, July 28, 2021",2022-06-09,"ALAUSA, IKEJA"
PURCHASE OF NEW GENERATOR FOR LASURA HEADQUARTER,LAGOS STATE URBAN RENEWAL AUTHORITY (LASURA),ocds-5q8fsw-6202256101527,"₦28,671,681.12",UPPER CLASS BUSINESS VENTURES LIMITED,Private Organization,,0,2021,COMPLETED,COMPLETED,"Thursday, June 17, 2021",2022-06-09,IKEJA LAGOS
Procurement of Office Equipment for office of Honourable Commissioner,OFFICE OF ENVIRONMENTAL SERVICES,ocds-5q8fsw-6202284137182,"₦2,174,900.00",HORTON TIMS VENTURES,Private Organization,,0,2021,COMPLETED,,"Thursday, April 22, 2021",2022-06-09,LAGOS STATE
Request for fund to organize Interactive Quiz Session b/w Students of Special and Ordinary school in Lagos State Pry Schools,OFFICE OF DISABILITY AFFAIRS,ocds-5q8fsw-6202234231224,"₦2,662,400.00",JAY 'N' EFF EVENT PLANNERS,Private Organization,,0,2021,COMPLETED,,"Monday, August 23, 2021",2022-06-09,"ALAUSA, IKEJA"
SUPPLY OF OFFICE EQUIPMENT FOR LASURA HEADQUATER,LAGOS STATE URBAN RENEWAL AUTHORITY (LASURA),ocds-5q8fsw-6202256551446,"₦14,943,100.00",BELTON CONCEPTS LIMITED,Private Organization,,0,2021,COMPLETED,COMPLETED,"Thursday, June 17, 2021",2022-06-09,"IKEJA, LAGOS"
IDENTIFYING AND BRANDING OF LASURA PROPERTY AND SHOPS IN LAGOS ISLAND,LAGOS STATE URBAN RENEWAL AUTHORITY (LASURA),ocds-5q8fsw-6202263504005,"₦45,000,000.00",UPPER CLASS BUSINESS VENTURES LIMITED,Private Organization,,0,2021,ON-GOING,,"Monday, June 14, 2021",2022-06-09,LAGOS ISLAND
"Request for fund to organize Ability Expo & Trade Fair for PWDs to showcase their talents, products and services.",OFFICE OF DISABILITY AFFAIRS,ocds-5q8fsw-6202255134732,"₦890,000.00",NEOTS LIMITED,Private Organization,,0,2021,COMPLETED,,"Wednesday, July 28, 2021",2022-06-09,"ALAUSA, IKEJA"
Procurement of Office Equipment for office of Permanent Secretary,OFFICE OF ENVIRONMENTAL SERVICES,ocds-5q8fsw-6202214048406,"₦2,312,500.00",DI TRADING POST VENTURES,Private Organization,,0,2021,COMPLETED,,"Thursday, April 22, 2021",2022-06-09,LAGOS STATE
REGENERATION STRATEGY FOR OTTO AND OTUMARA COMMUNITIES,LAGOS STATE URBAN RENEWAL AUTHORITY (LASURA),ocds-5q8fsw-6202287834130,"₦80,000,000.00",BELTON CONCEPTS LIMITED,Private Organization,,0,2021,ON-GOING,,"Monday, June 14, 2021",2022-06-09,LAGOS
Y2021 Sign Language Training Workshop.,OFFICE OF DISABILITY AFFAIRS,ocds-5q8fsw-6202201307800,"₦2,133,250.00",JAY 'N' EFF EVENT PLANNERS,Private Organization,,0,2021,COMPLETED,,"Monday, August 23, 2021",2022-06-09,"ALAUSA, IKEJA"
Procurement of Stationery and Consumables for Finance and Account Department,OFFICE OF ENVIRONMENTAL SERVICES,ocds-5q8fsw-6202285147866,"₦2,496,300.00",QISTA TECHNOLOGIES,Private Organization,,0,2021,COMPLETED,,"Tuesday, April 6, 2021",2022-06-09,LAGOS STATE
FOR PREPARATION OF PLANNING SCHEME FOR ALAUSA BLIGHTED SETTLEMENT IN LAGOS STATE.,LAGOS STATE URBAN RENEWAL AUTHORITY (LASURA),ocds-5q8fsw-6202207870174,"₦28,281,250.00",KADIRI ASSOCIATES LIMITED,Private Organization,,0,2021,COMPLETED,COMPLETED,"Friday, June 4, 2021",2022-06-09,LAGOS
PROCUREMENT/SUPPLY OF TWO(2) MOTORCYCLES IN LASURA,LAGOS STATE URBAN RENEWAL AUTHORITY (LASURA),ocds-5q8fsw-6202247531257,"₦4,430,000.73",JIRE'S PROPERTY COMPANY,Private Organization,"₦50,000,001 to ₦100,000,000",32,2021,COMPLETED,COMPLETED,"Friday, May 21, 2021",2022-06-09,IKEJA LAGOS
"Procurement of Cleaning items, Uniforms and Overall Kits",OFFICE OF ENVIRONMENTAL SERVICES,ocds-5q8fsw-6202276567126,"₦1,987,800.00",CONSTELLATION GLOBAL VENTURES,Private Organization,,0,2021,COMPLETED,,"Tuesday, April 6, 2021",2022-06-09,IKEJA LAGOS
SLUM IMPROVEMENT PLAN FOR IKOTA AND OLUSOSUN COMMUNITIES IN LAGOS ISLAND.,LAGOS STATE URBAN RENEWAL AUTHORITY (LASURA),ocds-5q8fsw-6202237124433,"₦173,500,000.00",URBAN PLANNING SMART SOLUTIONS LIMITED,Private Organization,,0,2021,ON-GOING,ONGOING,"Monday, May 24, 2021",2022-06-09,LAGOS ISLAND
"Procurement of Chemicals, Disinfectant Equipment and other Chemicals for Fumigation and Deratization",OFFICE OF ENVIRONMENTAL SERVICES,ocds-5q8fsw-6202267646330,"₦42,004,200.00",CIVIL HYDRO RELIANCE LIMITED,Private Organization,,0,2021,COMPLETED,,"Thursday, April 1, 2021",2022-06-09,LAGOS STATE
Regeneration Plan for Shomolu/Bariga and Ifelodun/Ijora/Badia Community,LAGOS STATE URBAN RENEWAL AUTHORITY (LASURA),ocds-5q8fsw-6202206815833,"₦226,069,963.00",SANNI &ASSOCIATES,Private Organization,,0,2021,ON-GOING,ONGOING,"Monday, April 26, 2021",2022-06-09,LAGOS
"Procurement of laptops, Office Equipment, dedicated Phones and Uniforms",OFFICE OF ENVIRONMENTAL SERVICES,ocds-5q8fsw-6202203175833,"₦6,751,900.00",DI TRADING POST VENTURES,Private Organization,,0,2021,COMPLETED,COMPLETED,"Monday, March 22, 2021",2022-06-09,Unspecified
CONSULTING SERVICES ON PROVISION OF LEGAL ADVISORY AND DRAFTING OF LAW FOR LASUED.,OFFICE OF SPECIAL ADVISER ON EDUCATION,ocds-5q8fsw-6202257655336,"₦50,000,000.00",HENLEY BARKING L P,Private Organization,"₦50,000,001 to ₦100,000,000",34,2021,COMPLETED,COMPLETED,"Thursday, March 4, 2021",2022-06-09,LAGOS
"Procurement of fumigation machine, vector controls chemicals, personal protective equipment and uniforms",OFFICE OF ENVIRONMENTAL SERVICES,ocds-5q8fsw-6202263065106,"₦7,652,000.00",OGS INTEGRATED SERVICES LTD,Private Organization,,0,2021,COMPLETED,,"Monday, March 22, 2021",2022-06-09,LAGOS STATE
CONSULTING SERVICES ON PROVISION OF LEGAL ADVISORY AND DRAFTING OF LAW FOR LASUSTECH.,OFFICE OF SPECIAL ADVISER ON EDUCATION,ocds-5q8fsw-6202248006127,"₦50,000,000.00",HENLEY BARKING L P,Private Organization,"₦50,000,001 to ₦100,000,000",34,2021,COMPLETED,COMPLETED,"Thursday, March 4, 2021",2022-06-09,LAGOS
"SUPPLY OF BOOKS"" BEHIND THE STREET""",OFFICE OF SPECIAL ADVISER ON EDUCATION,ocds-5q8fsw-6202275027553,"₦495,000,000.00",XS-PROFICIENT MEDIA SERVICES LIMITED,Private Organization,,0,2021,COMPLETED,COMPLETED,"Monday, April 12, 2021",2022-06-09,LAGOS
DEVELOPMENT OF AN ULTRA - MODERN TECHNOLOGY HUB FOR LASU,OFFICE OF SPECIAL ADVISER ON EDUCATION,ocds-5q8fsw-6202278373573,"₦2,013,037,790.84",BROADACRES LIMITED,Private Organization,,0,2021,ON-GOING,,"Tuesday, December 21, 2021",2022-06-09,LAGOS
Procurement of Public Address Equipment for indoor and Outside Usage,OFFICE OF ENVIRONMENTAL SERVICES,ocds-5q8fsw-6202257167625,"₦1,993,000.00",MOLAB AND SONS NIG ENT,Private Organization,,0,2021,COMPLETED,,"Wednesday, March 3, 2021",2022-06-09,IKEJA
PROCUREMENT OF ACCOUNTING EXPENSES FOR YEAR 2022,PRIMARY HEALTH CARE BOARD,ocds-5q8fsw-6202252684375,"₦1,990,000.00",RAWAQI LIMITED,Private Organization,"₦25,000,001 to ₦50,000,000",23,2022,COMPLETED,,"Thursday, March 31, 2022",2022-06-09,"YABA, LAGOS"
PROCUREMENT OF PERSONAL PROTECTIVE EQUIPMENT (PPE) AND ADVERSE EVENT FOLLOWING IMMUNIZATION (AEFI) KITS FOR PHASE 3 COVID -19 VACCINATIONS IN LAGOS STATE,PRIMARY HEALTH CARE BOARD,ocds-5q8fsw-6202247883710,"₦72,983,650.00",A AND J NIGERIA ENTERPRISES,Private Organization,"₦25,000,001 to ₦50,000,000",21,2022,COMPLETED,,"Thursday, March 31, 2022",2022-06-09,"YABA, LAGOS"
RENOVATION OF THE RECEPTION/FRONT DESK OFFICE OF THE MINISTRY,MINISTRY OF COMMERCE AND INDUSTRY,ocds-5q8fsw-6202286721510,"₦5,500,000.00",WINDSOR WOOD FURNITURE & FITTINGS,Private Organization,,0,2021,COMPLETED,,"Wednesday, March 3, 2021",2022-06-09,ALAUSA
THE SUPPLY & INSTALLATION OF LED DOUBLE BUCK-HEAD COMBO RENEWABLE ENERGY STREET LIGHTING WITHIN LASU CAMPUS.,OFFICE OF SPECIAL ADVISER ON EDUCATION,ocds-5q8fsw-6202248166110,"₦348,600,000.00",4LOGIX LIMITED,Private Organization,"₦100,000,001 to ₦200,000,000",34,2021,COMPLETED,,"Tuesday, November 2, 2021",2022-06-09,LAGOS
LAGOS STATE PARTICIPATION AT THE 2021 LAGOS INTERNATIONAL TRADE FAIR,MINISTRY OF COMMERCE AND INDUSTRY,ocds-5q8fsw-6202226464731,"₦30,000,000.00",TMZ EVENT PLANNERS,Private Organization,"₦25,000,001 to ₦50,000,000",25,2021,COMPLETED,,"Friday, May 14, 2021",2022-06-09,LAGOS
EDUDRAMA,OFFICE OF SPECIAL ADVISER ON EDUCATION,ocds-5q8fsw-6202287351180,"₦9,500,000.00",BACK2STAGE,Private Organization,"₦10,000,001 to ₦25,000,000",45,2021,COMPLETED,,"Wednesday, October 20, 2021",2022-06-09,LAGOS
"PROCUREMENT OF PLASTIC CHAIRS, PLASTIC TABLE, MEGAPHONES AND CANOPIES (UNICEF SUPPORT FOR PHASE 3 COVID MASS VACCINATION IN LAGOS STATE)",PRIMARY HEALTH CARE BOARD,ocds-5q8fsw-6202276361163,"₦29,943,000.00",RAWAQI LIMITED,Private Organization,"₦25,000,001 to ₦50,000,000",23,2021,COMPLETED,,"Wednesday, December 22, 2021",2022-06-09,"YABA, LAGOS"
REHABILITATION / UPGRADING OF 45 NOS PUBLIC LIBRARIES IN LAGOS SECONDARY SCHOOLS (PHASE 3).,OFFICE OF SPECIAL ADVISER ON EDUCATION,ocds-5q8fsw-6202257751005,"₦256,500,000.00",HYPERWORLD INT CO,Private Organization,,0,2021,ON-GOING,,"Wednesday, December 15, 2021",2022-06-09,LAGOS
THE STAGING OF 6TH LAGOS STATE MSMEs EXCLUSIVE FAIR,MINISTRY OF COMMERCE AND INDUSTRY,ocds-5q8fsw-6202242133005,"₦40,000,000.00",TMZ EVENT PLANNERS,Private Organization,"₦25,000,001 to ₦50,000,000",25,2021,COMPLETED,,"Wednesday, April 14, 2021",2022-06-09,LAGOS
PURCHASE AND INSTALLATION OF MAGNETIC CONFERENCE SYSTEM IN THE MINISTRY,MINISTRY OF COMMERCE AND INDUSTRY,ocds-5q8fsw-6202237360408,"₦2,304,000.00",VELPORT INTEGRATED SERVICES,Private Organization,"₦100,000,001 to ₦200,000,000",45,2021,COMPLETED,,"Thursday, April 8, 2021",2022-06-09,ALAUSA
"SUPPLY OF BOOKS"" BEHIND THE STREET""",OFFICE OF SPECIAL ADVISER ON EDUCATION,ocds-5q8fsw-6202238024814,"₦15,000,000.00",XS-PROFICIENT MEDIA SERVICES LIMITED,Private Organization,,0,2021,COMPLETED,,"Monday, October 18, 2021",2022-06-09,LAGOS
PROVISION OF UTILITY CROSS DUCTS ACROSS THE METROPOLIS (LOT 1),LAGOS STATE INFRASTRUCTURAL MAINTENANCE & REGULATORY AGENCY(LASMIRA),ocds-5q8fsw-6202230108103,"₦18,481,263.88",EXIM SAT NIGERIA LIMITED,Private Organization,,0,2021,COMPLETED,THE EXISTING SERVICE DUCT COVERS MADE OF LIGHT CONCRETE USUALLY GETS DAMAGED AND THE DUCT CHAMBERS LEFT OPEN POSTING POSSIBLE DANGER TO THE INHABITANTS OF THE STATE WILL BE RELOACATED TO THE CROSS DUCT AND REPLACE WITH REINFORCED SITU CONCRETE,"Monday, November 29, 2021",2022-06-09,"IKEJA, LAGOS"
TH DEVELOPMENT OF PHASE 1 TRUCK PARK FOR LEKKI FREE ZONE AXIS,MINISTRY OF COMMERCE AND INDUSTRY,ocds-5q8fsw-6202225825607,"₦607,414,238.00",DOMINANT ENGINEERING LTD,Private Organization,,0,2021,ONGOING,,"Friday, August 20, 2021",2022-06-09,LEKKI
REHABILITATION / UPGRADING OF 66 NOS PUBLIC LIBRARIES IN LAGOS SECONDARY SCHOOLS (PHASE 2),OFFICE OF SPECIAL ADVISER ON EDUCATION,ocds-5q8fsw-6202228516038,"₦495,000,000.00",HYPERWORLD INT CO,Private Organization,,0,2021,COMPLETED,,"Friday, August 13, 2021",2022-06-09,LAGOS
THE CONVERSION OF PORTAKABINS INTO OFFICES AND PROVISION OF FURNITURE EQUIPMENT FOR ALIMOSHO AREA OFFICE,MINISTRY OF COMMERCE AND INDUSTRY,ocds-5q8fsw-6202265378268,"₦16,642,701.73",MARKSEN PROJECTS LTD.,Private Organization,,0,2021,ONGOING,,"Friday, May 14, 2021",2022-06-09,"ALIMOSHO, LAGOS"
QUALITY CONTROL SYSTEM AND MANAGEMENT FOR TEMPERATURE EXCURSION FOR PHASE 3 COVID -19 VACCINATIONS IN LAGOS STATE,PRIMARY HEALTH CARE BOARD,ocds-5q8fsw-6202210075238,"₦12,540,000.00",PATH GLOBAL,Private Organization,,0,2022,COMPLETED,,"Tuesday, January 4, 2022",2022-06-09,"YABA, LAGOS"
EKO DIGITAL SKILLS PROGRAMME (PHASE 2),OFFICE OF SPECIAL ADVISER ON EDUCATION,ocds-5q8fsw-6202254204627,"₦220,000,000.00",ADVENT MANAGEMENT SOLUTION LIMITED,Private Organization,,0,2021,COMPLETED,,"Friday, August 13, 2021",2022-06-09,LAGOS
PROCUREMENT OF CHRONICLE BOARDS TO BE PLACED AT THE CONFERENCE ROOM OF THE MINISTRY'S,MINISTRY OF COMMERCE AND INDUSTRY,ocds-5q8fsw-6202228646631,"₦450,000.00",DAPSY PRINTS CONCEPT,Private Organization,,0,2021,COMPLETED,,"Thursday, April 8, 2021",2022-06-09,Unspecified
JOB INITIATIVE LAGOS PROGRAM (PHASE 2),OFFICE OF SPECIAL ADVISER ON EDUCATION,ocds-5q8fsw-6202203228205,"₦232,289,333.67",LOFTYINC ALLIED PARTNERS LIMITED,Private Organization,,0,2021,COMPLETED,,"Thursday, August 12, 2021",2022-06-09,LAGOS
DIGITALIZATION OF MEDICAL SERVICES AND ELECTRONIC MEDICAL SYSTEM OF THE PRIMARY HEALTH CARE (PHC) FACILITIES IN  LAGOS STATE,PRIMARY HEALTH CARE BOARD,ocds-5q8fsw-6202234727642,"₦280,684,000.00",TALAMUS HEALTHCARE LTD,Private Organization,,0,2022,COMPLETED,,"Thursday, February 3, 2022",2022-06-09,"YABA, LAGOS"
DESIGN OF THE OSAE RESOURCE PORTAL,OFFICE OF SPECIAL ADVISER ON EDUCATION,ocds-5q8fsw-6202254600377,"₦14,200,000.00",GIGADOTSOLUTION,Private Organization,,0,2021,COMPLETED,,"Friday, June 25, 2021",2022-06-09,"ALAUSA, LAGOS"
CONSULTING SERVICES FOR HOSTING Y2021 OSAE FAMILY RETREAT,OFFICE OF SPECIAL ADVISER ON EDUCATION,ocds-5q8fsw-6202251221534,"₦3,255,000.00",CODEBASE DERIVATIVES WAREHOUSE LIMITED,Private Organization,,0,2021,COMPLETED,,"Wednesday, June 16, 2021",2022-06-09,"ALAUSA, LAGOS"
RENOVATION OF IGBONLA PRIMARY HEALTH CARE CENTRE (PHCC) EREDO LCDA,PRIMARY HEALTH CARE BOARD,ocds-5q8fsw-6202285582340,"₦72,557,943.98",GAKWORLD NIGERIA LIMITED,Private Organization,,0,2021,COMPLETED,,"Friday, October 1, 2021",2022-06-09,"EREDO, LAGOS"
RENOVATION OF SOLU-ALADE PRIMARY HEALTH CARE CENTRE (PHCC) IN IBEJU LEKKI LG,PRIMARY HEALTH CARE BOARD,ocds-5q8fsw-6202251571168,"₦97,286,595.71",DEE MUFAT RESOURCES LIMITED,Private Organization,,0,2021,COMPLETED,,"Friday, October 1, 2021",2022-06-09,"LEKKI, LAGOS"
REHABILITATION / UPGRADING OF 66 NOS PUBLIC LIBRARIES IN LAGOS SECONDARY SCHOOLS (PHASE 1),OFFICE OF SPECIAL ADVISER ON EDUCATION,ocds-5q8fsw-6202210800515,"₦495,000,000.00",HYPERWORLD INT CO,Private Organization,,0,2021,COMPLETED,,"Thursday, April 15, 2021",2022-06-09,LAGOS
PUSH VACCINES FOR PHASE 2(FIRST DOSE) COVID-19 MODERNA CONSIGNMENT VACCINATION IN LAGOS STATE,PRIMARY HEALTH CARE BOARD,ocds-5q8fsw-6202205146332,"₦5,551,599.88",GAKWORLD NIGERIA LIMITED,Private Organization,,0,2021,COMPLETED,,"Tuesday, December 21, 2021",2022-06-09,"YABA, LAGOS"
JOB INITIATIVE LAGOS PROGRAM (PHASE 1),OFFICE OF SPECIAL ADVISER ON EDUCATION,ocds-5q8fsw-6202263304368,"₦232,289,333.67",LOFTYINC ALLIED PARTNERS LIMITED,Private Organization,,0,2021,COMPLETED,,"Thursday, March 11, 2021",2022-06-09,"ALAUSA, LAGOS"
EKO DIGITAL SKILLS PROGRAMME (PHASE 1),OFFICE OF SPECIAL ADVISER ON EDUCATION,ocds-5q8fsw-6202215203855,"₦265,250,000.00",ADVENT MANAGEMENT SOLUTION LIMITED,Private Organization,,0,2021,COMPLETED,,"Wednesday, March 10, 2021",2022-06-09,"ALAUSA, IKEJA"
PUSH VACCINES FOR PHASE 2 (SECOND DOSE) COVID-19 VACCINATION IN LAGOS STATE,PRIMARY HEALTH CARE BOARD,ocds-5q8fsw-6202221644651,"₦7,123,320.25",GAKWORLD NIGERIA LIMITED,Private Organization,,0,2021,COMPLETED,,"Tuesday, December 21, 2021",2022-06-09,"YABA, LAGOS"
PROCUREMENT OF PERSONAL PROTECTIVE EQUIPMENT (PPE) FOR PHASE 2 (SECOND DOSE) COVID-19 VACCINATION IN LAGOS STATE,PRIMARY HEALTH CARE BOARD,ocds-5q8fsw-6202253830645,"₦41,661,500.00",MEXZEN PHARMACEUTICAL AND CHEMICAL INDUSTRIES LIMITED,Private Organization,,0,2021,COMPLETED,,"Friday, December 24, 2021",2022-06-09,"YABA, LAGOS"
ENGAGEMENT OF INTERNAL ANALYST FOR PPP-BASED PROJECTS WITHIN THE OFFICE OF PUBLIC-PRIVATE PARTNERSHIPS,OFFICE OF PUBLIC PRIVATE PARTNERSHIPS,ocds-5q8fsw-6202288671722,"₦21,000,000.00",INDIVIDUAL CONSULTANTS,Private Organization,"₦50,000,001 to ₦100,000,000",34,2022,ONGOING,,"Monday, March 28, 2022",2022-06-09,OPPP
THE PROVISION OF FINANCIAL ADVISORY SERVICES ON PPP-RELATED PROJECTS DOMICILED IN THE OFFICE OF PUBLIC-PRIVATE PARTNERSHIPS,OFFICE OF PUBLIC PRIVATE PARTNERSHIPS,ocds-5q8fsw-6202255228084,"₦50,000,000.00",SYNONYMOUS SOLUTION LIMITED,Private Organization,"₦50,000,001 to ₦100,000,000",32,2021,COMPLETED,,"Thursday, September 23, 2021",2022-06-09,OPPP
REVAMPING THE WEBSITE AND INTEGRATING A PAYMENT GATEWAY FOR THE OFFICE OF PUBLIC-PRIVATE PARTNERSHIPS,OFFICE OF PUBLIC PRIVATE PARTNERSHIPS,ocds-5q8fsw-6202258502656,"₦9,997,500.00",QISTA TECHNOLOGIES,Private Organization,,0,2021,COMPLETED,,"Tuesday, August 3, 2021",2022-06-09,OPPP
THE PROVISION OF TECHNICAL ADVISORY SERVICES ON PPP-RELATED PROJECTS DOMICILED IN THE OFFICE OF PUBLIC-PRIVATE PARTNERSHIPS,OFFICE OF PUBLIC PRIVATE PARTNERSHIPS,ocds-5q8fsw-6202212172575,"₦49,890,000.00",MCOLIVIA CONSULTING LIMITED*,Private Organization,,0,2021,ONGOING,,"Thursday, September 23, 2021",2022-06-09,OPPP
THE PROVISION OF LEGAL ADVISORY SERVICES ON PPP-RELATED PROJECTS DOMICILED IN THE OFFICE OF PUBLIC-PRIVATE PARTNERSHIPS,OFFICE OF PUBLIC PRIVATE PARTNERSHIPS,ocds-5q8fsw-6202270511228,"₦53,000,000.00",LIBRA LAW OFFICE,Private Organization,,0,2021,COMPLETED,,"Thursday, September 23, 2021",2022-06-09,OPPP
THE DEMOLITION OF EXISTING BUILDINGS ON THE PROJECT SITE OF THE LAGOS MEDICAL PARK,OFFICE OF PUBLIC PRIVATE PARTNERSHIPS,ocds-5q8fsw-6202207361717,"₦70,998,375.00",MUMAY GLOBAL ENGINEERING SERVICES LTD,Private Organization,,0,2021,ONGOING,,"Tuesday, August 3, 2021",2022-06-09,LAGOS
STATE AND LGA LEVEL CAPACITY BUILDING ON THE IMPLEMENTATION OF BASIC HEALTH CARE PROVISION FUNDS IN LAGOS (EVENT PLANNING FOR CAPACITY BUILDING FOR BASIC HEALTH PROVISION FUND,PRIMARY HEALTH CARE BOARD,ocds-5q8fsw-6202263301514,"₦33,641,000.00",JAY 'N' EFF EVENT PLANNERS,Private Organization,,0,2021,COMPLETED,,"Friday, November 19, 2021",2022-06-09,"YABA, LAGOS"
PROCUREMENT OF MEDICAL CONSUMABLE AND PERSONAL PROTECTIVE EQUIPMENT FOR THE CONTAINMENT OF THIRD WAVE OF COVID -19 PANDEMIC AT THE LGAS IN LAGOS STATE FOR THREE(3 MONTHS),PRIMARY HEALTH CARE BOARD,ocds-5q8fsw-6202200553726,"₦14,997,200.00",MEXZEN PHARMACEUTICAL AND CHEMICAL INDUSTRIES LIMITED,Private Organization,,0,2021,COMPLETED,,"Friday, November 19, 2021",2022-06-08,"YABA, LAGOS"
PROCUREMENT OF PRINTER TONERS,PRIMARY HEALTH CARE BOARD,ocds-5q8fsw-6202275610515,"₦1,122,000.00",KINGSTON TECHNOLOGIES LTD,Private Organization,,0,2021,COMPLETED,,"Wednesday, August 11, 2021",2022-06-08,"YABA, LAGOS"
REHABILITATION OF REFRIGERATING UNIT AND RENOVATION OF MAIN BUILDING AT THE STATE NPI COLD STORE,PRIMARY HEALTH CARE BOARD,ocds-5q8fsw-6202240526013,"₦14,961,279.00",GAKWORLD NIGERIA LIMITED,Private Organization,,0,2021,COMPLETED,,"Wednesday, August 11, 2021",2022-06-08,"YABA, LAGOS"
PROCUREMENT OF PADIATRIC ZINC/LOW OSMOLARITY ORS CO-PACK TABLETS FOR THE PRIMARY HEALTH CARE CENTRES IN THE 57 LGAS/LCDAS IN LAGOS STATE,PRIMARY HEALTH CARE BOARD,ocds-5q8fsw-6202255876775,"₦9,237,987.00",MEXZEN PHARMACEUTICAL AND CHEMICAL INDUSTRIES LIMITED,Private Organization,,0,2021,COMPLETED,,"Wednesday, August 11, 2021",2022-06-08,"YABA, LAGOS"
PROCUREMENT OF MALARIA RAPID DIAGNOTIC TEST KIT FOR 200 PRIMARY HEALTH CENTERS IN LAGOS STATE,PRIMARY HEALTH CARE BOARD,ocds-5q8fsw-6202266268538,"₦23,018,400.00",WHEZ ENTERPRISES,Private Organization,,0,2021,COMPLETED,,"Wednesday, August 11, 2021",2022-06-08,"YABA, LAGOS"
RENOVATION OF DEBOJO PHC- ADDITIONAL WORKS (GATEHOUSE AND FENCE),PRIMARY HEALTH CARE BOARD,ocds-5q8fsw-6202245025328,"₦19,403,618.85",TICKTOS NIGERIA LIMITED,Private Organization,,0,2021,COMPLETED,,"Tuesday, August 10, 2021",2022-06-08,"YABA, LAGOS"
