date,title,article,url,thumbnail,author
28 June 2022,DENEL MEDICAL BENEFIT TRUST UPDATE,"Dear Beneficiary YOUR MEDICAL AID SUBSIDY As you may know, the High Court ruled on 24 February 2022 that the Trust Deed of the Denel Medical Benefit Trust ( DMBT ) must be amended. The purpose of this communication is to provide you with an update of where the DMBT is in terms of implementing the Court Order. To refresh everyone s memory, the Court Order has three important implications, namely: Firstly, you may have elected that instead of receiving a medical aid subsidy from Denel which is paid by the DMBT, you will receive a regular payment from an insurer. This amount will be equal to 66.7% or 15% (depending on the Denel subsidy you are entitled to) of the Discovery Health Essential Comprehensive premium which comes into effect from 1 October 2022, plus 20% thereon. This total amount (hereafter called The Amount ) is guaranteed to increase by inflation plus 4% on each 1 January, with the first increase being effective on 1 January 2023. Y Secondly, if you elected not to accept the above settlement offer , or you did not submit a signed option form to Denel, the DMBT will continue to pay Denel s subsidy to Discovery Health on your behalf. As such, nothing will change for you. The Court Order makes provision that sufficient money must be left in the DMBT so that there is a very high chance that the DMBT will be able to meet Denel s medical aid subsidy obligation to you. Thirdly, the excess assets of the DMBT, over and above that required to provide for the two sets of beneficiaries described above, will be paid to Denel. However, this payment to Denel will only be made once the money needed to secure the above benefits has been settled in full to the insurer. The DMBT is in advanced negotiations with an Insurer to be the appointed insurer. It is essential that sufficient time be spent on this negotiation process as the DMBT Trustees must be comfortable that your interests are well looked after for many years still. At this time the DMBT Trustees believe that there is a very good chance that the policy terms and payment will be finalised by the end of July 2022, although we cannot provide any guarantee in this regard. If we assume that the above target date is met and the implementation date is 1 August 2022, then the following will happen next: If you have accepted Denel s offer: (a)the appointed Insurer will pay the current subsidy amount to Discovery Health on your behalf, so nothing changes in this regard. (b)The difference between The Amount and Denel s subsidy (that is the money in (a) above) will be invested by the Insurer in a portfolio that earns money market returns. This money belongs to you but will be paid out at a later date (see below). (c)the Insurer will take steps to issue an individual policy in your name. It is expected that this process will take about three months which should result in completion around about 1 November 2022. (d)At the same time as the Insurer issues the individual policy, they will pay you the amount it has accumulated on your behalf as per (b) above. However, you will need to pay income tax on this amount. (e)Once the individual policy is in place, the Insurer will pay Discovery Health that part of The Amount you elect, with the balance being paid to you. Note that any amount paid to you will be subject to income tax. You will receive a detailed statement showing what has been paid to Discovery Health and what amount will be paid to you together with the income tax thereon when the Insurer issues you with an individual policy. If you did not accept Denel s offer, your benefits remain the same and Denel s current medical aid subsidy will continue to be paid to Discovery Health. The DMBT Trustees thank you for your patience while getting the Court Order implemented. We are getting close now and we will issue an update note once the DMBT has finalised the policy terms and paid the consideration to the Insurer. Yours faithfully PJ VAN DER MERWE On behalf of THE TRUSTEES OF THE DENEL MEDICAL BENEFIT TRUST Please share on:",http://www.denel.co.za/press-article/DENEL-MEDICAL-BENEFIT-TRUST-UPDATE/239,http://www.denel.co.za/images/logo.png,Denel
3 March 2022,Denel Medical Aid Subsidy Alternative Offer: Announcement,"Denel SOC Limited is pleased to announce that: On Thursday, 24 February 2022 the High Court of South Africa (Gauteng Division, Pretoria) granted an order varying the trust deed of the Denel Medical Benefit Trust (the DMBT ). The court order was obtained on the application of Denel.The order is one of the requirements for the implementation of the alternative offer in the form of individual annuities to beneficiaries. The order will enable Denel to arrange individual annuities for the DMBT members who have accepted Denel s offer to do so.The individual annuities provide DMBT members with enhanced benefits.The amendments will ensure that sufficient provision will be made to continue the current benefits of the members who did not accept the offer. The balance of the funds will go to Denel. Denel is engaging with the Trustees of the DMBT to take all of the steps required to arrange the individual annuities.More details and time frames will be communicated in due course. Those beneficiaries who still wish to accept the offer and have not yet responded are kindly invited to do so on or before 21 March 2022 after which no more responses will be accepted. Please contact us should you require additional clarity: Telephone: 012 671 2895 Email: dmbt@denel.co.za WhatsApp: 081 389 4330 www.denel.co.za Issued on 3 March 2022 Please share on:",http://www.denel.co.za/press-article/Denel-Medical-Aid-Subsidy-Alternative-Offer-Announcement/238,http://www.denel.co.za/images/logo.png,Denel
24 November 2021,Denel Medical Benefit Trust (DMBT) Update,"Your medical aid subsidy offer letter from DENEL SOC LIMITED Update Denel SOC Limited is delighted to provide you with the following update: Following the offer comprising of an individual annuity to all the beneficiaries an update on the process was sent to beneficiaries on 9 November 2021; As indicated in the update on 9 November 2021 Denel received a Notice with Intension to Oppose from the DMBT Trustees as well as UASA. The DMBT Trustees has after consultation with their legal counsel and actuaries decided not to oppose the application. They have provided the court with an affidavit containing their views and issues for consideration by the Court. No opposing papers were filed by UASA by the last date provided by the Court for such opposition of 22 November 2021. Therefore, no affidavits opposing the application have been filed by any of the interested parties. To date, 405 beneficiaries of the Denel Medical Benefit Trust have accepted Denel s offer of an individual annuity. This is more than 63%of the beneficiaries of the Trust. We have however received numerous requests from beneficiaries that requires further information or require additional time for review by their financial advisors. In order to allow the beneficiaries who have not yet accepted Denel s offer a further opportunity to also enjoy its benefits, Denel has in the letter of 9 November 2021 extended the date for relaying acceptance of the offer to midnight on Thursday, 9 December 2021. Those beneficiaries who still intend to accept the offer and have not yet responded are kindly reminded of the closing date above. Please note that it is unlikely that a further extension to the cut-off date for acceptances will be considered Please contact us should you require additional clarity: Telephone: 012 671 2895 Email: dmbt@denel.co.za WhatsApp: 081 389 4330 www.denel.co.za Wishing you and your loved one s good health and safety. Please share on:",http://www.denel.co.za/press-article/Denel-Medical-Benefit-Trust-DMBT-Update/237,http://www.denel.co.za/images/logo.png,Denel
9 November 2021,Denel Medical Benefit Trust (DMBT) Announcement,"Denel SOC Limited is pleased to announce that: To date, at least 375 beneficiaries of the Denel Medical Benefit Trust have accepted Denel s offer of an individual annuity.This is more than 57%of the beneficiaries of the Trust. In order to allow the beneficiaries who have not yet accepted Denel s offer a further opportunity to also enjoy its benefits, Denel hereby extends the date for relaying acceptance of the offer to midnight on 9 December 2021. Issued on 9 November 2021 Please share on:",http://www.denel.co.za/press-article/Denel-Medical-Benefit-Trust-DMBT-Announcement/236,http://www.denel.co.za/images/logo.png,Denel
11 August 2021,Far-Reaching Steps To Ensure Denel's Sustainability,"A streamlined and refocused Denel will be able to be a sustainable business and return to profitability within the next five years. This will be done through a comprehensive restructuring of the defence technology company. We are determined to turn Denel around and repurpose it while retaining the core capabilities required to meet South Africa s strategic security requirements, says William Hlakoane, the company s interim Group Chief Executive. Furthermore, we are encouraged by the unwavering support that we have been receiving from our shareholder, the Department of Public Enterprises. This is underlined by its acknowledgement that there is a need to assist Denel with regards to its financial situation. Thus, I am positive that the discussions with other government departments that have keen interest in Denel s survival such as the Department of Defence and the National Treasury will soon bear positive results . For our part as executive management and the Board, we have put together a comprehensive five-year plan to revitalise Denel, which the shareholder is fully behind. Part of this plan includes reducing Denel s current operating divisions (plus one subsidiary) from six to two. One division will focus on engineering, while the other focuses on manufacturing and maintenance, of which the latter is our core business. The engineering division will merge all Denel s capabilities in artillery, infantry and vehicle systems, its missile and precision-guided munitions business as well as its management of complex integrated systems. Furthermore, it will drive the company s diversification of technology into existing and new markets in fields such as command and control, cyber security and communications, whilst researching and developing new technologies of the future. The maintenance and manufacturing division will build on Denel s market reputation in the fields of aeronautics, unmanned aerial vehicle systems and the production of small and medium calibre ammunition as well as the production of combat vehicles. Denel s campuses will be optimised to reduce their footprint and contain costs. This will be supplemented by further reductions in the executive cost structure, and the implementation of the shared services model in areas such as supply chain management, human capital, IT and finance. Hlakoane says conservative estimates indicate that the sale of non-core or non-profit making assets will realise value of about R1.5bn over the next five years. However, there is an immediate need for significant cash injections to support current operations and implement the new operating model. Although some of these activities are at an advance stage, we do acknowledge that it will take some time to sell these assets while the payment of legacy debt and the requirements for liquidity are immediate, says Hlakoane. It is imperative for Denel to continue executing programmes in order generate cash to pay salaries and other operational requirements whilst driving these strategic actions. Notwithstanding the much-needed critical skills that we have lost over the past year as we struggled with payment of employee s salaries, the priority will be to rebuild these skills sets over time while maintaining the current. Denel of the future will have to be globally competitive, therefore it is critical that we are able to attract the next generation of engineers, designers, scientists and technicians, he says. Denel s board and management are not oblivious to the plight of our colleagues who continue to face hardship as a result of our inability to pay full salaries and we continue to work tirelessly to address this issue. We apologise for the stress and anxieties caused to employees and again give the assurance that we will do everything in our power to meet our obligations in line with employee contracts. Ends For further information, contact: Pam Malinda Cell: +27 (0) 82 686 2198 Tel: +27 (0) 12 671 2662 email: pamm@denel.co.za Please share on:",http://www.denel.co.za/press-article/Far-Reaching-Steps-To-Ensure-Denels-Sustainability/235,http://www.denel.co.za/images/logo.png,Denel
22 February 2021,Denel Appoints Mr William Hlakoane As Interim Group Chief Executive,"Denel has appointed Mr William Hlakoane as the acting Group Chief Executive Officer effective 22 February 2021. This is subsequent to Mr Talib Sadik s contract coming to an end. Hlakoane, a Mechanical Engineer by trade with an MBA from Milpark Business School, is the current Group Chief Operating Officer. His appointment allows for a seamless transition into the role. He has a wealth of experience in the manufacturing sector, backed by a solid career track record that adds value to Denel. He is an experienced executive in Operations Management with in-depth technical abilities, project management and business development. The Chairman of the Board, Ms Monhla Hlahla, wishes to thank the outgoing Mr Talib Sadik for the enormous value he has added over the years and more specifically during his acting period. Ms Hlahla further wishes to assure employees, suppliers, customers and all stakeholders that while the board is dealing with the difficult financial challenges facing Denel the focus remains on the business turnaround towards sustainable growth and profitability. The board welcomes Mr Hlakoane as the interim Group CEO and looks forward to working with him on a successful transformation of Denel. The recruitment process of the permanent Group CEO is underway and the appointment will be communicated to all stakeholders in due course. Ends For further information, contact: Pam Malinda Cell: +27 (0) 82 686 2198 Tel: +27 (0) 12 671 2970 email: pamm@denel.co.za Please share on:",http://www.denel.co.za/press-article/Denel-Appoints-Mr-William-Hlakoane-As-Interim-Group-Chief-Executive/234,http://www.denel.co.za/images/logo.png,Denel
17 August 2020,Denel Board Appoints Mr Talib Sadik as Interim Group Chief Executive,"The Board of Denel has appointed Mr Talib Sadik as the interim Group Chief Executive. Mr Sadik, a qualified Chartered Accountant (SA) and former non-executive director has worked with the Board in developing the turnaround plan and positions him well for a seamless transition.Mr Sadik served as Denel s Group CEO between 2008 and 2012 and brings a wealth of experience that will be of value to Denel. The Chairman of the Board, Ms Monhla Hlahla, says the Board is continuing its efforts to transform Denel into a sustainable defence and advance manufacturing company and wishes to assure our employees, suppliers, customers and all our stakeholders that the Board s focus on the turnaround strategy is top priority. The Shareholder and the Board continue to find solutions to resolve the short-term challenges of the company. The Board welcomes Mr Sadik into the interim role and looks forward to working with him on a successful outcome for Denel. The Audit Committee will continue to remain duly constituted as per the company s act. The recruitment process of the permanent Group CEO is underway and the appointment will be communicated to all stakeholders. Ends For further information, contact: Pam Malinda Cell: +27 (0) 82 686 2198 Tel: +27 (0) 12 671 2662 email: pamm@denel.co.za Please share on:",http://www.denel.co.za/press-article/Denel-Board-Appoints-Mr-Talib-Sadik-as-Interim-Group-Chief-Executive/233,http://www.denel.co.za/images/logo.png,Denel
27 May 2020,LOCAL VENTILATOR PROJECTS ARE REACHING CRITICAL STAGES,"Two projects to design and manufacture local ventilators to be used for the treatment of Covid-19 patients have reached critical stages. The design and layout phases have been completed and simulation exercises to test the efficacy of the projects will start soon. Project Sabela is coordinated by the defence and technology group, Denel, in partnership with other state-owned entities, research bodies and specialist companies in the private sector. Denel Dynamics, a global leader in the design and manufacturing of advanced missile and precision-guided weapon systems, has switched its focus to the production of medical ventilators to support patients who will be treated for the pandemic in public and private hospitals. In a parallel initiative Denel Land Systems, has joined forces with a leading university, engineering companies and a manufacturer of world-class domestic appliances to produce a full-function ventilator made from easy to source materials. Danie du Toit the Group CEO of Denel says considerable progress has been made in the design stage since Project Sabela was launched in early April. The aim of the project lead by Denel Dynamics is to design, develop and manufacture a low-cost, fit-for-purpose ventilator by utilising the skills and expertise of South African engineers, scientists, researchers, and technicians. We are optimistic about the potential to produce a low-cost, entry-level ventilator that can be used by the medical profession as the number of patients increase and the response levels are ramped up in the coming weeks, says Du Toit. The research team has evaluated a number of solutions proposed by companies across the world and eventually came up with its own design, a Bi-level Positive Airway Pressure (BiPAP) device. The team has built a prototype BiPAP ventilator from available, off-the-shelf hardware following an extensive period of consultation with experts and reviews against applicable standards. This prototype is now undergoing further testing and evaluation from which the second design will be made that will meet the requisite criteria for medical ventilators and can be manufactured at scale within South Africa. Du Toit says Denel is proud to be associated with this local initiative and is committed to utilise the resources and expertise used to manufacture defence products towards a medical crisis which is spreading across the world. Denel Land Systems is part of a team led by Cambridge University s Whittle Laboratory, Cambridge Aerothermal, Beko PLC, Prodrive UK and Defy Appliances to develop a low-cost ventilator the OVSI that can be used by patients requiring ventilation at field hospitals, during transport, in normal hospitals and intensive care units. Other companies in the Denel group are also contributing towards the national response to the pandemic during the lockdown stages. Denel Aeronautics is providing valuable technical support to the helicopter fleet of the South African Air Force which has been deployed in all nine provinces. The Oryx transport helicopters carry critical medical and humanitarian supplies to communities on a daily basis and also conduct surveillance operations. Denel Aeronautics has already carried out critical repair work on the main gearboxes of two Oryx helicopters and the technical support teams are on standby around-the-clock to do maintenance, repairs and testing of equipment. Similar technical support has been provided to the C-130 transport aircraft that are undergoing regular inspections, repairs and testing at Denel s maintenance, repair, and overhaul (MRO) facility at the Air Force Base Waterkloof. Ends For further information, contact: Pam Malinda Cell: +27 (0) 82 686 2198 Tel: +27 (0) 12 671 2970 email: pamm@denel.co.za Please share on:",http://www.denel.co.za/press-article/LOCAL-VENTILATOR-PROJECTS-ARE-REACHING-CRITICAL-STAGES/232,http://www.denel.co.za/images/logo.png,Denel
25 April 2020,DENEL EMPLOYEES RETURN SAFELY FROM SPAIN,"Denel is pleased to announce the safe return of four of its employees who have been working on a project based in Seville, Spain. The four landed this morning on board the SA Airways aircraft, SA2261, as part of a group of South Africans repatriated from Europe yesterday. They were contracted by Denel Aeronautics at the Airbus assembly plant in Seville, Spain, when the outbreak of the pandemic occurred. Denel Aeronautics had a contract with Airbus to deliver critical parts of the A400M airlifter. The parts are manufactured at the Denel Aeronautics campus in Kempton Park and then shipped to Seville for final assembly. Spain is one of the countries in Europe that has been hardest hit by the virus and the four could not immediately return because of the stringent travel restrictions imposed by both countries. Their stay had to be extended due to the lockdown in Spain and the cancellation of all flights to South Africa. The contract had been due to expire now in mid-April 2020. We want to thank the South African government, particularly the Department of International Relations and Cooperation (DIRCO), for facilitating the repatriation process of South Africans abroad and ensuring the safe return of the four employees back home. After landing in Johannesburg this morning, they have been placed in quarantine as a precautionary measure before being reunited with their families. Ends For further information, contact: Pam Malinda Cell: +27 (0) 82 686 2198 Tel: +27 (0) 12 671 2662 email: pamm@denel.co.za Please share on:",http://www.denel.co.za/press-article/DENEL-EMPLOYEES-RETURN-SAFELY-FROM-SPAIN/231,http://www.denel.co.za/images/logo.png,Denel
