date,title,article,url,thumbnail,author
12 May 2022,Rolls-Royce Holdings plc AGM statement and Trading update,"Rolls-Royce Holdings plc is holding its Annual General Meeting today and is hosting a site visit to its Civil Aerospace business tomorrow. Alongside these events, Rolls-Royce has issued the following trading update for the first four months of 2022 and also medium term outlook for its Civil Aerospace business. In his address to shareholders, Chief Executive Warren East will comment:  “In 2021, we delivered improved financial performance and continued to deliver on our commitments. As a result of the actions we have taken, we have made significant progress on the path to recovery from the impact of COVID-19 and are emerging as a better balanced and more resilient business with a sustainable future, focused on the long-term business opportunities presented by the global energy transition. I would like to thank our colleagues for their commitment and achievements this year and all our stakeholders for their support and engagement. It has been a privilege to lead Rolls-Royce and I am fully committed to driving our business while we work towards a smooth leadership transition this year. We are confident that we have positioned the business to achieve positive profit and cash this year, driven by the benefits of our cost reductions and increased engine flying hours in Civil Aerospace together with a strong performance in Defence and Power Systems, and balanced by our commitment to invest in technology and systems that are critical to the leading sustainable solutions we are delivering now and in the future.”    Trading update and outlook Financial performance year-to-date has been in line with expectation and our financial guidance for 2022 is unchanged. We are well positioned for the anticipated growth in our end markets and continue to expect positive momentum in our financial performance in 2022 despite the ongoing risks around macroeconomic uncertainties. We are working closely with our global supply chain to limit the impact of disruption and will continue to adapt our plans as the global situation evolves. Our long-term sourcing agreements and hedging policies designed to limit volatility in raw material inflation, give some near-term protection and we have increased inventory levels to help mitigate the impact. We are working with our suppliers to monitor and manage these risks and challenges. In Civil Aerospace, large engine long term service agreement (LTSA) flying hours for the first four months of 2022 were 42% higher than the prior year period. Passenger demand is recovering on routes where travel restrictions have been lifted, such as in Europe and the Americas, but additional COVID-19 restrictions have resulted in fewer flights in China where the situation is still evolving. Flying hours in Business Aviation have remained strong. Shop visits and original equipment (OE) deliveries of installed and spare engines are expected to accelerate during the course of the year. We are continuing to capitalise on new opportunities. For instance, Qantas recently committed to a deal for 12 Airbus A350-1000s for its long-haul Project Sunrise initiative, powered by our Trent XWB-97 engines. Rolls-Royce and Qantas have also committed to sign a TotalCare® service agreement for the Trent XWB-97 engines that will power the 12 aircraft.  In Defence, the products and services we provide are delivered and maintained over decades of service to our large number of customers and as such they are not immediately exposed to individual geopolitical events. Our strong order backlog gives us confidence on revenue, profit and cash conversion against the headwinds of inflation and supply chain risk. As guided previously, our operating margin is expected to be lower in 2022 compared with 2021, reflecting original equipment and aftermarket mix changes and the planned increase in investment in Defence to support new programme wins. Governments are increasing their long-term budget allocations towards defence activities, underpinning the long-term growth outlook we hold for Defence.  In Power Systems, the first four months of order intake has been very strong across the entire business and particularly in both power generation and defence end markets. We are working to limit the impact of supply chain disruption, in part through holding increased inventory, which as previously guided will impact cash conversion this year. Interest in sustainable solutions is increasing: the first engines for power generation, construction and industrial applications have been approved for operation with sustainable fuels and we are developing hydrogen engines. Our New Markets businesses, Rolls-Royce Electrical and Rolls-Royce SMR, continue to make good progress supported by Rolls-Royce and third-party investment. We have commenced the multi-year UK Generic Design Assessment process for our SMR design and we are encouraged by the recent commitment to nuclear energy by the UK Government. In Rolls-Royce Electrical, alongside the aircraft manufacturer Tecnam and engine manufacturer Rotax, we have completed the successful flight-testing of a hybrid-electric demonstrator aircraft powered by a parallel-hybrid propulsion system.  We are progressing well with our programme of disposals and are confident in achieving the commitment to generate around £2bn in total proceeds once the sale of ITP Aero completes, which is expected to be in the first half of this year, subject to regulatory approvals. The proceeds from the programme of disposals will be used to repay debt.  Civil Aerospace medium term outlook and site visit We are hosting a site visit at our Civil Aerospace facilities in Derby tomorrow, 13 May. The event will include tours of our facilities and a presentation with Q&A. We will set out our key Civil Aerospace value drivers, highlight the operational side of our business and provide a deeper understanding of how the changes we have implemented are making it a better quality, more resilient, and more agile business which is set up to increase returns and deliver long-term sustainable growth.  The presentation will include our view of the medium-term financial outlook for Civil Aerospace based on the actions we have taken to improve cost efficiency and productivity, combined with the current assumed recovery in demand, which is subject to risks and uncertainties based on prevailing market and macroeconomic conditions. In the medium term, we expect Civil Aerospace underlying revenue to grow at a low double-digit percentage compound average growth rate from 2021 with an operating margin percentage in the high single digits, and with trading cashflow comfortably exceeding operating profit.  Due to physical capacity constraints, the event is by invitation only but there will also be a webcast starting at 10am UK time on 13 May and lasting for approximately two hours. The webcast details and presentation materials will be shared on our website www.rolls-royce.com/investors and a replay will be made available after the event. Our next scheduled trading update will be on 4 August 2022, when we will publish our Half Year 2022 results. This announcement has been determined to contain inside information.",https://www.rolls-royce.com/media/press-releases/2022/12-05-2022-rr-holdings-plc-agm-statement-and-trading-update.aspx,https://www.rolls-royce.com/~/media/Images/R/Rolls-Royce/content-images/marine/discover/landing-images/pr-default-landing-image-v3.jpg?h=470&iar=0&w=500,Rolls-royce
11 May 2022,Rolls-Royce takes step towards net zero ambition with mtu gensets approved for sustainable fuels,"Following successful trials on the test bench and in the field, Rolls-Royce business unit Power Systems has approved its Series 1600 and Series 4000 generator sets for use with sustainable fuels.            Power Systems business approves mtu diesel engines for operation with sustainable fuels Full performance in power generation operation without the need for modification Up to 90% CO2 savings possible with hydrotreated vegetable oil  Rolls-Royce has taken a significant step towards meeting its net zero goals, set out last year, with the approval by Power Systems of its Series 4000 and Series 1600 diesel engines for use with a range of EN15940-certified synthetic diesel fuels in power generation applications. Following successful testing, including in the field, both types of engines can use a range of sustainable fuels including Biomass to Liquid (BtL), Hydrotreated Vegetable Oil (HVO) and Power to Liquid (PtL) fuels such as e-diesel. They can all be used to replace conventional diesel fuel. “There is already a lot of interest in HVO in particular from many customers in the energy industry and data center business, who want to improve their carbon footprint,” explained Tobias Ostermaier, president of the Stationary Power Solutions business unit at Rolls-Royce Power Systems. “The results from pilot customers show a significant reduction in greenhouse gases, nitrogen oxide and particulate emissions by using HVO instead of fossil diesel in their gensets.” Last year Rolls-Royce pledged to prove its most popular in-production engines, including the Series 4000, can be used with sustainable fuels by 2023.",https://www.rolls-royce.com/media/press-releases/2022/11-05-2022-takes-step-towards-net-zero-ambition-with-mtu-gensets-approved-for-sustainable-fuels.aspx,https://www.rolls-royce.com/~/media/Images/R/Rolls-Royce/Stories/2022/pr-11-05-2022a.jpg?h=470&iar=0&w=500,Rolls-royce
10 May 2022,Rolls-Royce submarines to launch Nuclear Skills Academy and new apprenticeships in Derby,"Image © Crown      Rolls-Royce Submarines Ltd will launch a new skills academy dedicated to nuclear training, alongside 200 additional nuclear apprenticeships starting in September 2022. As part of its drive to boost nuclear capability in the UK and to create a pipeline for nurturing talent right at the start of their careers, Rolls-Royce Submarines has committed to 200 new apprenticeships every year for at least the next ten years. Based in Derby, the new Nuclear Skills Academy will be supported by industry and education experts, including the Nuclear Advanced Manufacturing Research Centre, the National College for Nuclear, the University of Derby and Derby City Council. This ensures new apprentices will have access to the best courses and mentors throughout their apprenticeship.",https://www.rolls-royce.com/media/press-releases/2022/10-05-2022-rr-submarines-to-launch-nuclear-skills-academy-and-new-apprenticeships-in-derby.aspx,https://www.rolls-royce.com/~/media/Images/R/Rolls-Royce/Stories/2022/pr-10-05-2022.jpg?h=470&iar=0&w=500,Rolls-royce
2 May 2022,It’s a new dawn for Project Sunrise as Qantas announces agreement for 12 Trent XWB-97 powered Airbus A350-1000 aircraft,"Australian airline Qantas has committed to a deal for 12 Trent XWB-97 powered Airbus A350-1000s that will support its ambitions to operate the world’s longest commercial non-stop flights, allowing passengers to fly direct between London or New York to the Australian eastcoast cities of Sydney and Melbourne.  Rolls-Royce and Qantas have also committed to sign a TotalCare® service agreement for the Trent XWB-97 engines that will power the 12 aircraft, providing the airline with predictability and reliability for the services and maintenance of the new fleet. Ewen McDonald, Chief Customer Officer, Rolls-Royce Civil Aerospace, said: “We have been powering Qantas aircraft for more than 40 years and we are delighted to be making more history with Qantas on Project Sunrise. This project is closely aligned with our company’s passion for pioneering new innovation and achieving industry firsts. Our Trent XWB engine already has a pedigree in powering ultra long-haul flights and doing so with the maximum efficiency and reliability.” The Trent XWB-97 is the world’s most efficient large aero engine in service today, delivering a 15 per cent fuel consumption advantage over the first Trent engine, enabling our airlines to fly further on less fuel. It is also ready to operate on Sustainable Aviation Fuels (SAFs) as they become more available to airlines in the future – this is in line with our commitment to proving all Trent engines are compatible with 100% SAF by 2023. In addition, through industry leading engine efficiency the Trent XWB has contributed to avoiding more than 10 million tonnes of CO2 since it launched in 2015.  As well as offering improved efficiency, the Trent XWB delivers a step change in out-of-the-box maturity and reliability for the industry, consistently achieving better than 99.9% dispatch reliability. Following its entry into service in 2015, the Trent XWB, which exclusively powers the Airbus A350, quickly became the fastest selling large engine of all time. It has now achieved more than eight million engine flying hours in service with more than 30 operators, demonstrating its versatility and capability by flying a range of different routes, from short-range segments to ultra-long-range flights of around 18 hours.",https://www.rolls-royce.com/media/press-releases/2022/02-05-2022-poweroftrent-its-a-new-dawn-for-project-sunrise.aspx,https://www.rolls-royce.com/~/media/Images/R/Rolls-Royce/Stories/2022/pr-02-05-2022-landing-img.jpg?h=470&iar=0&w=500,Rolls-royce
7 April 2022,Infosys and Rolls-Royce extend strategic collaboration with launch of joint ‘Aerospace Engineering and Digital Innovation Centre’ in India,"Infosys (NSE, BSE, NYSE: INFY), a global leader in next-generation digital services and consulting, and Rolls-Royce, one of the world’s leading industrial technology companies, today inaugurated their joint ‘Aerospace Engineering and Digital Innovation Centre’  in Bengaluru, India. This centre has been established to provide high-end research and development (R&D) services integrated with advanced digital capabilities to Rolls-Royce’s engineering and group business services from India. Infosys and Rolls-Royce’s collaboration has been reinforced through strategic deals, aimed at yielding mutual benefits to both organisations over the next seven years. Speaking about the new centre, Kishore Jayaraman, President – India and South Asia, Rolls-Royce, said, “Our strategic partnership with Infosys presents an exciting opportunity for both companies to leverage combined strengths in engineering and digital innovation to accelerate growth in the civil aerospace market. Given the aerospace sector is poised for revival and growth in India and across the world, this joint innovation centre will strengthen Rolls-Royce’s global engineering ecosystem and position us well for the future.” Astrid Hartmann, Director of Global Business Services, Rolls-Royce added, “Infosys is a valued partner to Rolls-Royce, and the capabilities from this collaboration will certainly enhance our shared services portfolio and bring greater value to the business. We remain committed to India and look forward to tapping the rich talent and potential in this market.” Commenting on the engagement, Jasmeet Singh, Executive Vice President and Global Head of Manufacturing, Infosys, said, ""We are delighted to extend our collaboration with Rolls-Royce and work towards digitally transforming engineering and business process management shared services in India. We will aim to be a catalyst for Rolls-Royce to deliver efficiency, effectiveness and experience while driving continuous change towards creating a value ecosystem that is sustainable. This engagement is testament to the longstanding collaboration between Infosys and Rolls-Royce, which is poised to set new benchmarks in the aerospace, defence, and manufacturing sectors.” As part of this collaboration, Infosys and Rolls-Royce will combine their aerospace, engineering and digital services capabilities to explore opportunities for driving digital and engineering innovation and associated cost optimisation strategies. By expanding the local talent pool in the country, the two companies will also deliver manufacturing engineering services for the global civil aerospace ecosystem. Over the last decade, Rolls-Royce established a multidisciplinary engineering centre in Bengaluru as part of its efforts to boost engineering and R&D services in India. In December 2020, Infosys and Rolls-Royce announced a collaboration for sourcing engineering and R&D services for Rolls-Royce’s Civil Aerospace business, whereby Rolls-Royce transitioned a significant part of its engineering centre capabilities to Infosys. Infosys will continue to harness its experience, expertise, and investments in the domain to strengthen its existing capabilities and deliver enhanced end-to-end solutions while optimising operational costs for its customers.",https://www.rolls-royce.com/media/press-releases/2022/07-04-2022-infosys-and-rr-extend-strategic-collaboration.aspx,https://www.rolls-royce.com/~/media/Images/R/Rolls-Royce/Stories/2022/pr-07-04-2022a.jpg?h=470&iar=0&w=500,Rolls-royce
7 April 2022,Executive team change,"Rolls-Royce (LSE:RR., ADR:RYCEY) announces that Andreas Schell, President – Power Systems, has decided to step down to take up the post of CEO at Energie Baden-Württemberg AG (EnBW), one of the largest energy companies in Germany and Europe. The search for his successor is currently underway and a further announcement will be made in due course. Andreas, who joined at the start of 2017, will continue in his current role to ensure a seamless transition but no later than the end of the year. Warren East, CEO, said: “Andreas has successfully repositioned our Power Systems business from an engine manufacturer to a provider of sustainable power solutions and set it upon a firm path to capture the commercial opportunity presented by the energy transition. He has strengthened the leadership team in the business and together they have secured the highest order book in the organisation’s history. I would like to thank him for his hard work and perseverance over the past five years and also his commitment to leading the business while we work towards a smooth leadership transition.”",https://www.rolls-royce.com/media/press-releases/2022/07-04-2022-executive-team-change.aspx,https://www.rolls-royce.com/~/media/Images/R/Rolls-Royce/content-images/marine/discover/landing-images/pr-default-landing-image-v3.jpg?h=470&iar=0&w=500,Rolls-royce
5 April 2022,Rolls-Royce launches new mtu NautIQ products with Sea Machines technology to deliver intelligent crew support systems,"Rolls-Royce offers three new mtu NautIQ products with different levels of intelligent crew support, autonomous control, and remote command capabilities  Important contribution to safety, efficiency, and net zero targets  Powered by Sea Machines technology   Rolls-Royce is expanding its range of mtu NautIQ ship automation systems with three new products: mtu NautIQ CoPilot, mtu NautIQ CoOperate and mtu NautIQ CoDirect, which each offer different levels of intelligent crew support, autonomous control, and remote command capabilities. Customers in all marine applications will gain significant operational advantages and benefits in terms of safety, efficiency, environmental impact, and climate friendliness. The new products are the next step in the cooperation between Rolls-Royce and Sea Machines Robotics, the leading developer of autonomous control and remote-vessel command systems, which was first announced at Monaco Yacht Show in September 2021. The continued development of the mtu NautIQ product range is at the core of Rolls-Royce’s strategy to be an innovation leader in the marine business and to provide customers with complete propulsion and control solutions from ‘bridge to propeller’.  mtu NautIQ CoPilot is the most advanced intelligent pilot assist system of the new product range. Depending on operating mode, the human-on-the-loop system can either autonomously control a planned voyage from start to finish, or not intervene at all in human operations, while only guiding the operator. The system enables navigation with greater precision and predictability, helping to reduce costs, fuel consumption and emissions. It is an important step towards more climate-friendly marine operations, made possible by the groundbreaking fusion of digital marine sensors, embedded electronic charts, advanced AI algorithms and one of the world’s most advanced broad-area computer vision systems.  mtu NautIQ CoOperate is an optionally autonomous ship navigation command system which enables off-boat remote command, including all payloads on board. The system can take over routine and monotonous vessel tasks and it allows crews to focus on more important aspects of their missions. The system has recently proven itself in the field in spectacular fashion: The tug Nellie Bly used the system to complete a 1,000 NM roundtrip from Hamburg around Denmark, remotely commanded from an office in Boston, USA, 3,000 NM away. As with all the new products, operators can intervene at any moment if necessary. mtu NautIQ CoDirect is a wireless, remote-helm system that can control a vessel’s engines, steering and transmission as well as payload functions such as winches and cranes from a distance of up to 1,000 metres. This allows marine crews to operate the vessel from the best vantage point, increasing safety and efficiency. For example, a tug operator can leave the wheelhouse to operate the vessel from a location with better visibility.  Michael Johnson, CEO and founder of Sea Machines, said: “This continued partnership is significant because it brings together a foremost marine power and propulsion solutions provider and the leading developer of advanced and AI-based vessel control systems. Our alliance not only increases access to intelligent technologies that can positively impact operators’ bottom lines, productivity, eco-stewardship and safety, but it also provides proof of the growing market demand for these types of systems for real-world operations. We thank Rolls-Royce for their continued trust in our technology and look forward to seeing them in use aboard a variety of vessel types globally.”  Denise Kurtulus, Vice President Global Marine at Rolls-Royce business unit Power Systems, said: “I am excited to see how quickly the teams of Rolls-Royce and Sea Machines have turned our joint vision into products available for our customers. This addition to our mtu NautIQ product portfolio is an important part of our journey towards a provider of integrated sustainable solutions. And it’s a fantastic example of how we, as a company with long history and tradition, implement cutting-edge technology – which benefits our customers and the environment alike – in a very agile way.” Rolls-Royce business unit Power Systems, with its product and solution brand mtu, is pioneering climate-friendly propulsion and power solutions in the marine market. It is currently transforming itself from an engine manufacturer to a provider of integrated sustainable solutions. With the sustainability programme “Net Zero at Power Systems”, Rolls-Royce Power Systems is taking concrete steps towards climate-neutral solutions. For example, starting in 2023, the company will release its mtu Series 2000 and 4000 engines for sustainable fuels such as e-diesel and second-generation biofuels, thus enabling climate-neutral operation in all applications. In addition to using sustainable fuels, the company is also working on new technologies such as CO2-free fuel cell systems. Press photos are available for download from https://www.mtu-solutions.com/eu/en/news-and-media/media-center.html",https://www.rolls-royce.com/media/press-releases/2022/05-04-2022-rr-launches-new-mtu-nautiq-products-with-sea-machines-technology.aspx,https://www.rolls-royce.com/~/media/Images/R/Rolls-Royce/Stories/2022/pr-05-04-2022-landing-image.jpg?h=470&iar=0&w=500,Rolls-royce
